"text","class_label"
"good luck to the powerlinkqld crews and their communities as they recover from the impacts of tcdebbie stay saf","noneyewitness"
"queensland schools closed after cyclone debbie wreaksda havoc","noneyewitness"
"dead bull shark washes up in severe floods","noneyewitness"
"cyclone debbie has heard that dallas is in texas and texas is on the nswqld border somewhere","noneyewitness"
"did cyclone debbie have a little sister that we dont know about cause the rain in auckland this morning is crazy lol","noneyewitness"
"australias queensland buckling down for cyclone debbie people evacuated in by","noneyewitness"
"bull shark after tropical cyclone debbie in queensland utc disaster typhoon video","noneyewitness"
"excyclone debbie about","noneyewitness"
"brilliant service from brisbanecityqld mulching the fallen jacarabda tree in paddington thanks fellas amp be safe","noneyewitness"
"sad news the little cocky that was rescued from airliebeach has died cyclonedebbie","noneyewitness"
"it reached brisbane already n hope everythings fine","noneyewitness"
"extremely dangerous behaviour captured at murwillumbah weir tcdebbie qldweather news","noneyewitness"
"my favorite place on earth soo sad hamilton islands cyclone debbie nightmare via mailonline","noneyewitness"
"cyclone debbie proved one thing australians are super weird","noneyewitness"
"thousands evacuated as cyclone debbie barrels toward australian coast","noneyewitness"
"debbie the cockatoo that was saved from a category cyclone has died","noneyewitness"
"dnddnd nqueensland schools close as excyclone debbie brings wild weather south n by newsqueensland bigwet","noneyewitness"
"all brisbane schools closed as cyclone debbie brings torrential rain","noneyewitness"
"wonder how csg and ucg mining infrastructure is coping with cyclonedebbie abcrural abcnews thefeedsbs sbsnews","noneyewitness"
"due to the bad weather caused by former tropical cyclone debbie staff and students at all usq campuses are not expected on campus today","noneyewitness"
"didgin to the end of cyclone debbie via youtube","noneyewitness"
"bom warns brisbane southeast queensland face flooding from excyclone debbie","noneyewitness"
"tour boats are back on the water in the whitsunday islands and businesses in airlie beach are working around the","noneyewitness"
"the picture of the poor cockatoo caught in cyclone debbie has made me sad not retweeting the picture","noneyewitness"
"news cyclone severe weather gold coast smashed by extropical cyclone debbies sting in","noneyewitness"
"grocery prices will rise across australia because of cyclone debbie heres what is affected via abcnews","noneyewitness"
"flood emergency latest live coverage on chqueensland now tcdebbie news","noneyewitness"
"creek levels rising across the goldcoast as ex tcdebbie sweeps the east coast newsgoldcoast newsqueensland","noneyewitness"
"se qld shuts down due to excyclone debbie","noneyewitness"
"i liked a youtube video from andysfishing cyclone debbie natural disaster how i survived ep","noneyewitness"
"cyclone debbie wont stop coral bleaching expert says a live guardian ocean environment","noneyewitness"
"all schools closed today and friday due to wild weather from excyclone debbie system tcdebbie news","noneyewitness"
"southeast queensland schools closed due to bad weather caused by cyclone debbie gtgt","noneyewitness"
"mackay region road closures tcdebbie bigwet ifitsfloodedforgetit","noneyewitness"
"dapto family stuck on hamilton island as cyclone debbie hits photos video","noneyewitness"
"greens blame cyclone debbie on burning coal","noneyewitness"
"gold coast flooding clear water island video richy anderson story tcdebbie news","noneyewitness"
"cyclone debbie south east queensland prepares for powerful flash flooding","noneyewitness"
"premises still without power on the sunshine coast live coverage on channel","noneyewitness"
"explorers forewarned not to drink water as cyclone debbie causes also floodingda clearings","noneyewitness"
"despite warnings bros are surfing on floodwaters brunt of australias cyclone debbie h","noneyewitness"
"residents told to stay indoors as powerful cyclone debbie makes landfall in australias queensland","noneyewitness"
"cyclone debbie footage shows monster storm hit queensland","noneyewitness"
"debbie the cockatoo that was saved from a category four cyclone has died buzzfeed","noneyewitness"
"we ve just tweeted some service updates due to tcdebbie but for more info please visit staysafe bigwet","noneyewitness"
"cyclone debbie completely covering north queensland it was a very windy few days in mackay cyclonedebbie mackay","noneyewitness"
"service updates gt our buses to australiazoo are cancelled due to weather events affected customers will be contacted bigwet tcdebbie","noneyewitness"
"nothing bad is gonna happen today cyclone debbie happens at least theres no school today sips tears cyclonedebbie","noneyewitness"
"director of ops david hartley providing an update to news on qas response to ex tcdebbie and bigwet","noneyewitness"
"bbc news cyclone debbie monster storm makes landfall in australia geographyteacher","noneyewitness"
"pictures the damage caused by cyclonedebbie in australia cyclone debbie cyclonedebbie","noneyewitness"
"all schools in se qld closed tcdebbie bigwet","noneyewitness"
"view from km exposes cyclone debbies force of nature via abcnews geography geographyteacher","noneyewitness"
"news armenian cyclone debbie monster storm makes landfall in australia bbc news bbc","noneyewitness"
"speaking to ergon yesterday power in the whitsundays is still some days away cyclonedebbie tcdebbie whitsundays airliebeach","noneyewitness"
"cyclone debbie southeast queensland prepares for powerful flash flooding","noneyewitness"
"our thoughts are with those who are suffering damage and loss due to the severe cyclone debbie hitting towns","noneyewitness"
"news goldcoast more than homes without power in queensland after devastation of cyclone debbie as","noneyewitness"
"remnant of ex tropical cyclone debbie","noneyewitness"
"met officeheavy rain continues from excyclone debbie","noneyewitness"
"this family will certainly never forget cyclone debbie guess what they named their little miracle","noneyewitness"
"queensland cleans up after cyclone debbie via abcemergency","noneyewitness"
"rossriverdam does it look like tsv will get any rain from tcdebbie","noneyewitness"
"cyclone debbie is a blessing and a curse","noneyewitness"
"battered cyclone debbie cockatoo loses fight","noneyewitness"
"flash flooding emergency in areas of queensland brought on by ex tropical cyclone debbie tcdebbie news","noneyewitness"
"to make up for cyclone debbie cancelling our tuesday work day our wonderful therapists mark ross moana and","noneyewitness"
"important contacts for queenslanders impacted by extropical cyclone debbie for storm and flood assistance","noneyewitness"
"no brisbane this is not a cyclone bigwet bneweather bnestorm tcdebbie cyclonedebbie","noneyewitness"
"impact image of cyclone debbie australia a shark kilometers offshore","noneyewitness"
"thousands still cut off with supplies diminishing after destructive cyclone debbie","noneyewitness"
"cyclone debbie deaths feared in australia flood emergency","noneyewitness"
"insurers hit with cyclone debbie claims brace for more sydney news","noneyewitness"
"sparing a thought for this cockatoo in airlie queensland and all other wildlife being hit by cyclone debbie d","noneyewitness"
"brisbanes entire education system has been shut down due to cyclone debbie","noneyewitness"
"excyclone debbie causes flooding in southeast queensland","noneyewitness"
"so many kids trying to get home without umbrellas tcdebbie bigwet schoolsclosed","noneyewitness"
"reporters slammed for venturing right into the path of cyclone debbie","noneyewitness"
"started out talking about hurricane debbie i mean cyclone debbie n natheres a surfer going out into waves in stor","noneyewitness"
"reallife sharknado cyclone debbie washes up shark on australian street the guardian straya","noneyewitness"
"cyclone debbie southeast queensland prepares for powerful flash flooding sydney news","noneyewitness"
"richarddinatale will you condemn adam bandts comments that cyclone debbie is a result of coal fire power stations or do agree with him","noneyewitness"
"southeast queensland schools closed due to bad weather caused by cyclone debbie herald sun herald sun southeast a","noneyewitness"
"interesting creatures washed up on the gc beach after ex tropical cyclone debbie departed cyclonedebbie tcdebbie","noneyewitness"
"flood watch bom has issued a floodwatch for the following nsw areas as a result of tropical cyclone debbie","noneyewitness"
"extropical cyclone debbie moving south toward northern nsw on thursday st march bringing potential heavy rain","noneyewitness"
"cyclone debbie hammers queensland video photos port macquarie news","noneyewitness"
"torrential rain hits lismore northern rivers region after cyclone debbie follow our blog for live updates","noneyewitness"
"breaking premier annastacia palaszczuk holds a press conference regarding the latest on ex tcdebbie","noneyewitness"
"reuters world news thousands shelter as screaming howling cyclone debbie hits north australia reuters world","noneyewitness"
"no this isnt after cyclone debbie but it could be dont take nature for granted the law of cause and effect m","noneyewitness"
"still monitoring reports and watching tcdebbie heading back out over the s pacific","noneyewitness"
"destruction of cyclone debbie in pictures","noneyewitness"
"cyclone debbies hit a range of agricultural sectors including sugar horticulture and dairy","noneyewitness"
"what happened to debbie the cyclone cockatoo","noneyewitness"
"qld amp nsw heavy rain and flooding is expected as extropical cyclone debbie moves southeast","noneyewitness"
"brisbane venues are split in response to extc debbies arrival heres whats still on and whats not be safe","noneyewitness"
"looks like the us flag was the only one to survive tcdebbie abcnews","noneyewitness"
"excyclone debbie about people trapped by floods around mackay a live world peace","noneyewitness"
"lots of pain amp traumatic experiences resulting from cyclone debbie please spare a moment to think of the poor souls in the middle of it","noneyewitness"
"shocking photos of queensland cyclone debbie destruction","noneyewitness"
"shute harbour a war zone after cyclone debbie","noneyewitness"
"australia hit by a powerful cyclone debbie via the all newspaper","noneyewitness"
"tcdebbie southeast queensland schools shut as excyclone tracks south via abcnews","noneyewitness"
"the latest from the bomqld on tropical cyclone debbie live coverage tcdebbie news","noneyewitness"
"welcome to presh kalus blog excyclone debbie forces mass closure of queenslan","noneyewitness"
"with the devastation of cyclone debbie still being assessed and the looming flood crisis in both queensland and","noneyewitness"
"sydney weather wet and wild conditions ahead as excyclone debbie drifts south sydney morning herald environment","noneyewitness"
"holiday hell on hamilton island after cyclone debbie via mailonline","noneyewitness"
"come at me ex tropical cyclone debbie bigwet qldsummer cycloneseason","noneyewitness"
"dnddnd ncyclone debbie hits north queensland n","noneyewitness"
"scary winds of cyclone debbie thrashing an island just off qld australia","noneyewitness"
"school in brisvegas cancelled because rain","noneyewitness"
"all schools closed in south east queensland today due to extreme weather from ex cyclone urged to shut early","noneyewitness"
"sydney weather wet and wild conditions ahead as excyclone debbie drifts south","noneyewitness"
"southeast queensland to be lashed by excyclone debbie","noneyewitness"
"bbc cyclone debbie experts fear damage to great barrier reef asia","noneyewitness"
"cyclone debbie queensland police fear fatalities with extent of damage unclear","noneyewitness"
"early reports of damage in wake of australias cyclone debbie","noneyewitness"
"schools in brisbane closed due to extreme weather conditions brought on by ex tropical cyclone debbie news","noneyewitness"
"support queenslanders doing it tough donate now to our tropical cyclone debbie appeal at o","noneyewitness"
"latest news on the aftermath of cyclone debbie see abcnews live blog via abcnews","noneyewitness"
"has your business been affected by tropical cyclone debbie find out what support amp assistance is available bigwet","noneyewitness"
"mackay set for days without power in the wake of cycloneda debbie","noneyewitness"
"so university of queensland is shutting the doors today due to excyclone debbie thats a pretty big call bigwet","noneyewitness"
"cyclonedebbie the view from space exposes a force of nature","noneyewitness"
"brisbane city photo michelle sherin ng tcdebbie news","noneyewitness"
"nsw floods as debbies remnants lash state northqueensland queensland","noneyewitness"
"cyclone debbie caused my lecture to be cancelled lol","noneyewitness"
"debbie is now an excyclone and is doing more damage by being wet as debbegetswet debbiedoesqld","noneyewitness"
"weather update northern nsw bearing brunt of excyclone debbie with major flooding mass","noneyewitness"
"flooding in bundaberg live coverage on channel now warnings news","noneyewitness"
"heyphii i keep forgetting debbies the cyclone so im like whos debbie and whys everyone talking smack about her","noneyewitness"
"cyclone debbie queenslands big wet brings widespread flooding to north and south","noneyewitness"
"the go girl family wishes everyone who has been affected by cyclone debbie the very best especially our bowen","noneyewitness"
"raging floodwaters from tropical cyclone debbie flow through a completely submerged car in queensland australia a","noneyewitness"
"cyclone debbie hitting brisbane cyclonedebbie brisbane cyclone","noneyewitness"
"cyclone debbie batters northeast australia","noneyewitness"
"keep up to date with traffic conditions including flooded roads with the qld traffic app tcdebbie qldtraffic","noneyewitness"
"qpsmedia is there a hotline to call amp check if relatives have been caught up in cyclone debbie or what areas dont have comms cant find","noneyewitness"
"increasingly angry tourists have been urged not to drink the water in the whitsundays as cyclone debbie s aftermath a","noneyewitness"
"several roads flooded at glenview live coverage on channel now stream tcdebbie news","noneyewitness"
"cyclone debbie eye of storm makes landfall in north queensland a live updates","noneyewitness"
"schools to be closed again tomorrow as extropical cyclone debbie descends on south east queensland news","noneyewitness"
"rockhampton road closure information bigwet qldfloods tcdebbie","noneyewitness"
"excellent infographics here about the strength and impacts of cyclonedebbie flooding now along qld amp nsw coast","noneyewitness"
"the effects of cyclone debbie are now being felt in the south eastern parts of the state flooding is still","noneyewitness"
"dnd cyclone debbie hits north queensland","noneyewitness"
"due to the severe weather event cyclone debbie the keno ahg expo will be closing today at pm","noneyewitness"
"googleausedexcyclone debbie heads south live updates the australian","noneyewitness"
"cyclone debbie threatens queensland coal exports","noneyewitness"
"couldnt believe seeing both dumb morning news shows reporting this morning from the damn beachfront in cyclone z","noneyewitness"
"cyclone debbie experts fear damage to great barrierda reef","noneyewitness"
"residents in northern nsw are preparing to evacuate news","noneyewitness"
"essential supplies sorted bring on excyclone debbie chevron island","noneyewitness"
"cyclone debbie tourism operators concerned at visitors being spooked","noneyewitness"
"cyclone debbie south east queensland prepares for powerful flash flooding","noneyewitness"
"flash flooding emergency in areas of queensland brought on by ex tropical cyclone debbie tcdebbie news","noneyewitness"
"believealive beliiiiiiiiiiiiiiiiiiiiiiiiiiiiiiiiiiiiiiiiiiiiiiiiiiiiiiii yea in qld cyclone debbie im in nsw","noneyewitness"
"brisbanes entire education system has been shut down due to cyclone debbie","noneyewitness"
"australia shark washes up on street during cyclone debbie itvnews itv news","noneyewitness"
"thousands shelter as screaming howling cyclone debbie hits north australia","noneyewitness"
"more than people are still without power in bowen ameliaadam tcdebbie news","noneyewitness"
"lets call it cyclone palaszczuk given shes just been in india whoring out the galilee basin to adani","noneyewitness"
"wishing my favorite place was safe from cyclone debbie","noneyewitness"
"schools closed as brisbane braces for nightmare in cyclone debbies via","noneyewitness"
"brisbane dashboard has just been added bigwet tcdebbie cyclonedebbie","noneyewitness"
"gr to see the qldhealthnews family coming together to help each other thanks also the staff being relieved for","noneyewitness"
"fuck off cyclone debbie formals tomorrow n n","noneyewitness"
"an emergency alert has been issued for tallebudgera valley residents katiebrownaus tcdebbie news","noneyewitness"
"drones to view damage as insurers hit with cyclone debbie claims innovation tcdebbie insurance via smh","noneyewitness"
"coles food stocks have been ransacked tcdebbie","noneyewitness"
"that is bad stay sheltered and dry a a","noneyewitness"
"highdefinition satellite image pm awst tropical cyclone debbie","noneyewitness"
"excyclone debbie about people trapped by floods around mackay a live","noneyewitness"
"a bull shark was today found washed up after devastation of cyclone debbie in burdekin north queensland","noneyewitness"
"bbcworld cyclone debbie deaths feared in australia flood emergency","noneyewitness"
"still flooded areas coast calming down bbc news cyclone debbie two women killed as floods hit eastern australia","noneyewitness"
"cyclone debbie forces ship to take cruise to nowhere missscruff","noneyewitness"
"excyclone debbie causes flooding in southeast queensland","noneyewitness"
"cyclone debbies devastating floods as seen from the air","noneyewitness"
"bull shark found in puddle after cyclone debbie queensland northqueensland","noneyewitness"
"excyclone debbie forces mass closure of queensland schools","noneyewitness"
"stormwater infrastructure already starting to struggle in brisbane bigwet tcdebbie abcnewsbrisbane bneweather","noneyewitness"
"looks like the rain from tcdebbie is about to end off you fuck now debbie youve done enough for one week","noneyewitness"
"cyclone debbie you have weeks to cut the crap cause it flying up to northern queensland soon","noneyewitness"
"bom warns brisbane southeast queensland face flooding from excyclone debbie","noneyewitness"
"i feel the need to apologize for cyclone debbie even tho she spells her name wrong","noneyewitness"
"cyclone debbie damages homes cuts power to in australia via","noneyewitness"
"schools were cancelled roads flooded power went down how has ex tropical cyclone debbie changed your plans","noneyewitness"
"cheers cyclone debbie for probably forcing the i prevail show to cancel a","noneyewitness"
"widespread flooding as excyclone debbie headsda southeast","noneyewitness"
"bull shark becomes unlikely victim of cyclone debbie via newscomauhq","noneyewitness"
"cyclone debbie wreaks havoc as storm tears through australia","noneyewitness"
"meanwhile in australia","noneyewitness"
"google news sharks sandbags and surfing cyclone debbie brings floods to queensland cnn","noneyewitness"
"the storm is lashing the queensland coast with torrential rain bringing about a significant flooding risk","noneyewitness"
"storms flash flooding may hit ipswich after cyclone","noneyewitness"
"hope everyone back home stays stay from this flooding from ex cyclone debbie","noneyewitness"
"cyclone debbie hits the queensland coast news melbourne victoria","noneyewitness"
"with queensland severely affected by tcdebbies bigwet studioau focuses on the big issues qldpol","noneyewitness"
"prices could skyrocket what cyclone debbie could do to australia s fruit prices the new daily","noneyewitness"
"more than schools and students impacted by cyclone debbie closures tcdebbie news","noneyewitness"
"cyclone debbie deadly storm batters australia live update via youtube","noneyewitness"
"roof damage at holiday apartments on hamiltonisland at catseye beach cyclonedebbie tcdebbie","noneyewitness"
"tenants with homes damaged by cyclone debbie must continue to pay rent find out more here","noneyewitness"
"cyclone debbie farmers can see crop damage but are largely optimistic via abcrural australiangrown","noneyewitness"
"if you are requiring assistance with purchasing food after tcdebbie but do not meet the criteria via the","noneyewitness"
"trucks submerged in floodwaters after cyclone debbie trucks submerged floodwaters after cyclone debbie","noneyewitness"
"tractor bogged in the cane fields near proserpine tcdebbie bigwet","noneyewitness"
"hopefully our farmers inland will get a drop or two tcdebbie","noneyewitness"
"sydney weather wet and wild conditions ahead as excyclone debbie driftsda south","noneyewitness"
"as seq weathers extropical cyclone debbie nq begins to survey the aftermath of bearing the brunt","noneyewitness"
"two victorian tourists arrive on the mainland after sitting through cyclone debbie on daydream island tcdebbie","noneyewitness"
"no schooldnddnd nqueensland schools close as excyclone debbie brings wild weather south n by newsqueensland","noneyewitness"
"more wild videos from australia showing tropical cyclone debbie approach","noneyewitness"
"cyclone debbie family in australia please stay safe wherever you are af f nadnd f","noneyewitness"
"assistance may be available to those affected by cyclone debbie","noneyewitness"
"hamilton island cleans up after cyclone debbie via brisbanetimes","noneyewitness"
"cyclone debbie","noneyewitness"
"investing thousands shelter as screaming howling cyclone debbie hits north australia","noneyewitness"
"not even cyclone debbie could stop the safe arrival of olivia grace sister for annabeth and our","noneyewitness"
"debbie has not left queensland yet stay safe everyone live updates here bigwet","noneyewitness"
"everything is closing which i think is very appropriate","noneyewitness"
"mashable cyclone debbie proved one thing australians are super weird","noneyewitness"
"rt bbcnewsaus all schools in southeast queensland closed amid fears of flashflooding caused by excyclone debbie","noneyewitness"
"latest news excyclone debbie about people trapped by floods around mackay a live","noneyewitness"
"baby girl born safely during cyclone debbie","noneyewitness"
"tasmanian emergency services assist in recovery effort following cyclone debbie news","noneyewitness"
"science dead bull shark found in aftermath of cyclone debbie the metreandahalf bu","noneyewitness"
"sydney weather wet and wild conditions ahead as excyclone debbie drifts south","noneyewitness"
"six people on sippy creek road have been evacuated by swift water rescue teams danimcpherson tcdebbie news","noneyewitness"
"tropical cyclone debbie utc disaster typhoon video","noneyewitness"
"not something you see everyday shark washed up on the road following cyclone debbie floods","noneyewitness"
"service updates gt due to tcdebbie there are no services between hervey bay lt gt townsville if affected we will contact you","noneyewitness"
"tenants with homes damaged by cyclone debbie must continue to pay rent via domaincomau","noneyewitness"
"jdpx tonight has been rescheduled to next week thanks to cyclone debbies inability to stick to a schedule","noneyewitness"
"school was cancelled today due to the cyclone debbie everything seems calm now for the southeast qld","noneyewitness"
"monster cyclone debbie batters northeast australia","noneyewitness"
"the sunshine coast is in for some more wild weather today as excyclone debbie makes her way south please stay","noneyewitness"
"all guests have been evacuated from daydreamisland today thankfully tcdebbie","noneyewitness"
"evacuated nsw residents bunker down","noneyewitness"
"its been a huge week cyclone debbie power outages storms and flooding and dst finally comes to an end on","noneyewitness"
"service updates gt due to tcdebbie services are limited townsville lt gt cairns if your bus is cancelled we will contact you","noneyewitness"
"cyclone debbie deadly storm batters australia","noneyewitness"
"our thoughts and prayers are with those who have been affected by the devastation of cyclone debbie stay safe","noneyewitness"
"excyclone debbie forces mass closure of queensland schools","noneyewitness"
"curse you debbie now its personal tomato capsicum prices set to rise after cyclone debbie","noneyewitness"
"tropical cyclone debbie battersda australia","noneyewitness"
"cyclone debbie continues to cause chaos in australia top news","noneyewitness"
"ex tropical cyclone debbie full list of flooded gold coast roads gold coast bulletin","noneyewitness"
"flooding in bundaberg live coverage on channel now warnings news","noneyewitness"
"this is one reason why we dont want motorists driving through flood waters u cant predict what lies beneath","noneyewitness"
"spare a thought for those exposed to cyclonedebbie","noneyewitness"
"debbies floods spark rescues off roofs sbs news","noneyewitness"
"ocean sciences article of the day cyclone debbies cooling wont prevent great barrier reef bleaching guardian","noneyewitness"
"its not over yet gladstone could still feel wrath of excyclone debbie","noneyewitness"
"target australia charge for water after cyclone debbie via mailonline","noneyewitness"
