"text","class_label"
"ex cyclone debbie is bringing some bad weather where i am and so all schools in se qld are closed so i have early holidays yay a","direct_eyewitness"
"we r receiving the tail end of cyclone debbie theres lots of flooding and all schools in queensland aust have been closed the wind is wild","direct_eyewitness"
"little bit late i know cyclone debbie done messed up my town good but strim on solo arbitrator","direct_eyewitness"
"like being in the path of a train our hamilton island holiday with cyclone debbie","direct_eyewitness"
"we have had a huge drenching in our area the after effect of cyclone debbie during a break in the weather i","direct_eyewitness"
"cyclone debbie turns to sharknado as one washes up on road","direct_eyewitness"
"dont be like me stay inside please a","direct_eyewitness"
"so my umbrella just injured me when i tried to walk dudley in extropical cyclone debbie","direct_eyewitness"
"cyclone debbie got schools cancelled all over queensland for two days let the holidays begin d","direct_eyewitness"
"see all that green im somewhere under that floodwatch tcdebbie weather","direct_eyewitness"
"thanks to cyclone debbie for not only destroying my hometown but also cancelling all flights making me miss the dixiechicks concert nd","direct_eyewitness"
"cyclone debbie has just hit where i live so no school today all people in queensland please stay safe c","direct_eyewitness"
"hot tip water wrecks the door and the woodwork and your floor which itll get under if it gets under the door jam bnestorm tcdebbie","direct_eyewitness"
"delighted to be fleeing cyclone debbie on the last flight to leave for melbourne idontlikerain","direct_eyewitness"
"no school bed apartment flooding yo thanks tcdebbie","direct_eyewitness"
"oh guess what my state is being effected by the excyclone debbiethe leftover rainwind is approaching","direct_eyewitness"
"now the sky and the ocean are teaming up to kill us in australia","direct_eyewitness"
"joesugg currently stuck in the aftermath of cyclone debbie what gaming series of yours should i binge watch","direct_eyewitness"
"running into rain and wind to pick up debre had me feeling like this tcdebbie","direct_eyewitness"
"cyclone debbie has been hitting hard all day and only getting harder sandbags in place riding it out","direct_eyewitness"
"damn you cyclone debbie i cant get my groceries today","direct_eyewitness"
"cyclone debbie hitting brisbane isnt all bad just been told we dont have to go into work because its unsafe add","direct_eyewitness"
"today has been crazy sitting here in the eye of ex cyclone debbie waiting for it to pass before the winds flare up for one last blast","direct_eyewitness"
"all schools closed in se qld due to the remnants of cyclone debbie this will throw today into a bit of chaos","direct_eyewitness"
"when you get evacuated because of fucking cyclone debbie fuckdebbie","direct_eyewitness"
"wellgold coast are underwater nowa will get back to ship on next monday god bless fort golff fortegolf","direct_eyewitness"
"farmhouse in which i rode out cyclone debbie ferocious winds tore holes in walls smashed windows today it was","direct_eyewitness"
"work got canceled from the weather due to cyclone debbie my weekend starts early","direct_eyewitness"
"were getting a little wet today excyclone debbie has sent us some rain not a great day for","direct_eyewitness"
"the rain just got heavier tcdebbie debbiedoesqld","direct_eyewitness"
"sooo cyclone debbie decided to have a holiday in brisbane everything is closed thanks girl","direct_eyewitness"
"other than some rain amp what ive seen on here amp facebookwhat cycloneflooding qldpol tcdebbie","direct_eyewitness"
"ubisoftsupport its all good now cyclone debbie is gone now and the power is back on","direct_eyewitness"
"ok guys i want to keep you updated we are currently flooded in my area because of the aftermath of cyclone debbie","direct_eyewitness"
"by the way we survived cyclone debbie a bit wet but survived","direct_eyewitness"
"flight cancelled due to cyclone debbie and virginaustralia refuse to refund the flight awful customer service will never use them again","direct_eyewitness"
"school was cancelled for today and tomorrow cause of cyclone debbie hitting the east coast of qld australia yay but it was soo boring c","direct_eyewitness"
"artistabbas im in severe weather last bit of ex cyclone debbie ill do my best rt but keep losing connection still got power thoughdnd b","direct_eyewitness"
"showering after digging trenches around our home amp hoping we dont get flooded from cyclone debbie ad","direct_eyewitness"
"mulalaevalisto feeling great because as cyclone debbie is happening around my state school is cancelled and i can sleep","direct_eyewitness"
"a bit of flooding in our area in brisbane we may need an ark tonight d debbie cyclonedebbie bigwet floods","direct_eyewitness"
"australian cyclone debbie is really having us here a d","direct_eyewitness"
"on my way to do very early school pickup thanks excyclone debbie","direct_eyewitness"
"i feel this guys pain my drive was a bit like this dodging flooded streets d","direct_eyewitness"
"memorieholiday im gonna have to watch this stream because i feel like cyclone debbie dropped me off in a twilight zone","direct_eyewitness"
"tomorrow is one of my last math classes before the exam worth of my grade thanks to cyclone debbie im flooded and stuck home uni","direct_eyewitness"
"cyclone update d d d ddadnd we are currently suffering the tail end of cyclone debbie under the","direct_eyewitness"
"i streamed lecture this morning but no cbl because classes canceled because of remnants of cyclone debbie brisbane closed bigwet","direct_eyewitness"
"bigwet first road block police officer waves us through saying thanks for coming redcrossau tcdebbie","direct_eyewitness"
"cyclone debbie can kindly leave now nd","direct_eyewitness"
"cyclone debbie has arrived gold coast queensland","direct_eyewitness"
"starting to really feel the effects of cyclone debbie cyclonedebbie","direct_eyewitness"
"she may be an ex cyclone but debbie is still cranky bitch mopping my patio count as active rest flooded","direct_eyewitness"
"queensland venues issue updates on tonight s urthboy i prevail and spiderbait shows as cyclone debbie hits","direct_eyewitness"
"queensland stay safe and im sorry to everyone effected by cyclone debbie but i am loving this rain","direct_eyewitness"
"stay safe qld our bridge is still operational avoid travel have a conferencecall bigwet bneweather","direct_eyewitness"
"debbie would you stop being a bitch already youve done enough damage","direct_eyewitness"
"cyclone debbies devastating floods as seen from the air","direct_eyewitness"
"when school gets cancelled because of cyclone debbie","direct_eyewitness"
"i grew up in queensland and used to go swimming in the disgusting flood waters how hard am i","direct_eyewitness"
"this is the remains of cyclone debbie heading my way","direct_eyewitness"
"cyclone debbie but at least its a day off school","direct_eyewitness"
"is that the best youve got debbie bring it on","direct_eyewitness"
"i survived cyclone debbie thanks to all the parma and coriander advocates for your concern u kents","direct_eyewitness"
"miss cyclone debbie you really are overstaying your welcome you are also getting too noisy im choosing to","direct_eyewitness"
"due to the current weather event in se qld we are closed amp will reopen next week thoughts are with all effected staysafe tcdebbie","direct_eyewitness"
"cyclone debbie forced us to rescheduled our show in brisbane tonight add on more flights to our schedule a a fuckyoudebbie","direct_eyewitness"
"cyclone debbie has ruined my day","direct_eyewitness"
"nothing like a bit of preholiday stress due to all of the trains you need to get to the airport being cancelled because of cyclone debbie","direct_eyewitness"
"no work amp school d vinaka cyclone debbie","direct_eyewitness"
"my class is cancelled today as a result of cyclone debbie ill take this as an opportunity to relax and try to get ahead of my classes nf da","direct_eyewitness"
"yew im in cyclone debbie","direct_eyewitness"
"watching the destruction left behind by tc debbie lismore is underwater the river near my house is about burst and more rain is reported","direct_eyewitness"
"debbie has caused havoc up north but down here were cracking the champagne tcdebbie farmlife","direct_eyewitness"
"cyclone debbie has made her way down to where we are","direct_eyewitness"
"the view from my office from the leftovers of tcdebbie never seen so much water in my life","direct_eyewitness"
"holyy shitttttt no wonder why the wind is fucking crazy","direct_eyewitness"
"hey everyone we are still here after cyclone debbie we are doing our best to be up and running asap","direct_eyewitness"
"fleuranderson all ok fleur cyclone debbie has left me dazedbut i have wine in hand so all is good stuff bottled water","direct_eyewitness"
"so this is the leftover of cyclone debbie australia queensland","direct_eyewitness"
"mikedoylecomedy airlie beach was devastated by cyclone debbie","direct_eyewitness"
"cyclone debbie got a big wet","direct_eyewitness"
"just about survived cyclone debbie d","direct_eyewitness"
"britishairways hi ba thanks to cyclone debbie my qantas flight to london has been delayed meaning there is a strong possibility i will","direct_eyewitness"
"mulalaevalisto im feeling great just contemplating life as cyclone debbie occurs in my state but its all good because no school for me","direct_eyewitness"
"youcanbethestar it s torrential rain from cyclone debbie and i m still thinking of snatching this cunt","direct_eyewitness"
"jlist welcome ex tropical cyclone debbie we are under that somewhere your daughters old school most of se qld","direct_eyewitness"
"all schools last min closed down bcos of the storm fk cyclone debbie is halfway here alr","direct_eyewitness"
"inspecting tcdebbie aftermath w turnbullmalcolm nth qlders r resilient but the days weeks amp months ahead r go","direct_eyewitness"
"i cant imagine what cyclone debbie was like at full strength we are experiencing the tail end and this is scary enough d","direct_eyewitness"
"lol at home we have snow days and cold days but here uni is closed bc of cyclone debbie hahahahahahah sick na d","direct_eyewitness"
"debbie debbie debbiewhat have you donediadnd i went up north to meet up with you why did you come home with me to brisbane tcdebbie","direct_eyewitness"
"thanks to the weather from cyclone debbie i get a day off from uni today only problem is a class from today has an assignment due tonight","direct_eyewitness"
"zacharylevi you guys wouldnt what windy is this is happening to us right now","direct_eyewitness"
"because people keep asking i m all good and safe where i live cyclone debbie is causing some flooding","direct_eyewitness"
"ayyeeee work got cancelled cause of the floodssss thank you cyclone debbie da","direct_eyewitness"
"jetstarairways not being helpful need to change my flights due to cyclone debbie no one able to assist cyclonedebbie","direct_eyewitness"
"i am getting hit by the ex tropical cyclone named debbie right now storm rain and flooding is heading my way right now","direct_eyewitness"
"wet wet wet today is a great day to stay indoors extropical cyclone debbie has spread into northern nsw and is","direct_eyewitness"
"update tcdebbie flooding is ongoing we are still flash flooding across the south east visit for more info bigwet","direct_eyewitness"
"we are now setting up the recovery hubs in mackay tcdebbie more info to come mackaycouncil","direct_eyewitness"
"child happy school cancelled cause of flash flooding from cyclone debbie bit windy and wet but still gotta go out","direct_eyewitness"
"scrowder my luck dragon just survived cyclone debbie with me in australia i win","direct_eyewitness"
"oh good more rain and humidity sydney tcdebbie","direct_eyewitness"
"cyclone debbie is ruining my life tbh","direct_eyewitness"
"this one was shot yesterday morning before the after effects of cyclone debbie reached our","direct_eyewitness"
"my awol is undamaged apart from bent antenna after cyclone debbie captain webb on the aft deck day after","direct_eyewitness"
"am i gonna die","direct_eyewitness"
"im fine here btw high rise and all but they are warning people in low lying areas to get ready to evacuate tail end of cyclone debbie","direct_eyewitness"
"thank you for your prompt service energex brisbanecityqld longwet tcdebbie treedown besafe","direct_eyewitness"
"mystic i cant go outside cyclone debbie is holding me hostage","direct_eyewitness"
"made it through tcdebbie hoping everyone thats going to get hit with the following wind and rain stays safe","direct_eyewitness"
"school just got cancelled because of cyclone debbie can you tell that im a queenslander","direct_eyewitness"
"hi thanks for flooding us amp cancelling school cyclone debbie","direct_eyewitness"
"just wish cyclone debbie had hit when i actually had uni","direct_eyewitness"
"im lowkey not complaining about cyclone debbie down where i live cause its just raining and i love it","direct_eyewitness"
"thank u cyclone debbie for cancelling school and work across queensland tru mvp","direct_eyewitness"
"tropical cyclone debbie as we saw it at ausyfish utc disaster typhoon video","direct_eyewitness"
"hi everyone in case anyone missed me im back afterdays of cyclone debbie with no internet its lovely to see the sunshine","direct_eyewitness"
"i saw where cyclone debbie hit australia glad that youre ok and still sharing your journey","direct_eyewitness"
"this rain from cyclone debbie is insane even down here on the gold coasteverywhere is flooded flood cyclonedebbie goldcoast","direct_eyewitness"
"laura good were good me there should be a reality tv show about us ricky there is a reality tv show its called the news tcdebbie","direct_eyewitness"
"all schools closed in queenslands southeast corner as extropical cyclone debbie descends all scho a","direct_eyewitness"
"weve had a five day weekend thanks to debbie ive never been so grateful for a cyclone before","direct_eyewitness"
"on side note even cyclone debbie hit brissy im safe guys na","direct_eyewitness"
"im seeing panic hiring of dvds near riot as only decent ones have gone tcdebbie","direct_eyewitness"
"thanks cyclone debbie no school yayaya","direct_eyewitness"
"when cyclone debbie finally hits and you have no power but your phone is on a n whos the real winner debbie","direct_eyewitness"
"amyleeev not dark here in sth east queensland but very wet thanks to ex tropical cyclone debbie","direct_eyewitness"
"cyclone debbie has given me a day off school today chance to catch up on marking","direct_eyewitness"
"cyclone debbie can fuck right off i have work today and its non stop raining kms","direct_eyewitness"
"here come the rain mm of rain from ex cyclone debbie going to get flood in next week sometime","direct_eyewitness"
"heres how were responding to cyclone debbie to keep you connected","direct_eyewitness"
"airlie beach in recovery mode rained all night still without power and water tcdebbie","direct_eyewitness"
"current situation where i am lol everyone at work has gone home before theyre flooded and cant get home im all","direct_eyewitness"
"we hope everyone is safe from cyclone debbie were open again come visit call detectives","direct_eyewitness"
"no uni today thanks cyclone debbie","direct_eyewitness"
"about the cyclone debbie happening here in queensland i am safe here in my own house ill continue to make any updates in the next hour","direct_eyewitness"
"aaaron yeah im smack bang in the middle hahaha its the aftermath of cyclone debbie","direct_eyewitness"
"cyclone debbie is messing up my shit so i had to slide into amysharkmusic insta comments to get advice on how to","direct_eyewitness"
"cyclone debbie flood a no school yay a","direct_eyewitness"
"i survived cyclone debbie im not deadyet a jk im alive and well no power internet and service drops in and out ill try update","direct_eyewitness"
"cyclone debbie is coming my way and im fucking pissed","direct_eyewitness"
"when you cant get to work because the road is flooded ctcdebbie ifitsfloodedforgetit","direct_eyewitness"
"the harada team trapped in a resort because of cyclone debbie lets work on a ping pong table and organise a","direct_eyewitness"
"feels when school is cancelled because of remains of cyclone debbie","direct_eyewitness"
"classes cancelled at uq due to ex tcdebbie making travel ill advisdd","direct_eyewitness"
"all my nia classes cancelled today and tomorrow due to severe weather via abcnews","direct_eyewitness"
"this is why debbie the cyclone was so upset","direct_eyewitness"
"cyclone debbies rain is becoming unbearable","direct_eyewitness"
"weekend in noosa via airbnb cancelled with less than a days notice and got full refund tcdebbie","direct_eyewitness"
"because of cyclone debbieclasses are cancelled exams cancelled but no ones gonna stop olivia to go to the beach a a a wot even","direct_eyewitness"
"hr rainfall so far from the fallout of ex tropical cyclone debbie on brisbanelets just say its a bit wet today","direct_eyewitness"
"my house almost flood because of the rain from cyclone debbie thanks to the ses for helping out today much love to those on the mountain ad","direct_eyewitness"
"no sleep last night thanks to cyclone debbie trees over possibly scariest nights sleep of my life","direct_eyewitness"
"hmm looks like weve caught the tail end of this cyclone bigwet debbie raingalore","direct_eyewitness"
"mm of rain has fallen here just this morning and the rain gauge is spinning like a petrol pump as we catch the tail of cyclone debbie","direct_eyewitness"
"cyclone debbies tail is hitting us today so im getting flooded in they said its going to get worse too","direct_eyewitness"
"training inside again after ex tcdebbie amp thenannystate shut down brisbane today tried","direct_eyewitness"
"more rain we are getting the edges of cyclone debbie category that hit north queensland","direct_eyewitness"
"school got cancelled because of cyclone debbie i have assessment to doooo","direct_eyewitness"
"in brisbane for data collection but half of it was cancelled because of the tropical low that was cyclone debbie nd","direct_eyewitness"
"cyclone debbie hit overnight im flooded in my shift got cancelled bc the park is lowkey flooding and weve lost power","direct_eyewitness"
"cyclone debbie took its toll on north queensland and saw the competition cancelled today at the aussies staying dry was tough","direct_eyewitness"
"when one of the bros needs a ride to work during cyclone debbie","direct_eyewitness"
"thanks cyclone debbie for no school today ellabeattie","direct_eyewitness"
"in torrential rain a couple of angles have delivered food and coffee for me and the crew thankyou tcdebbie","direct_eyewitness"
"just had the remains of the edge of cyclone debbie reach us luckily our house is fine but were flooded left right and centre","direct_eyewitness"
"all classes cancelled today wew coz of the after effects of cyclone debbie","direct_eyewitness"
"just pulled a hour shift during cyclone debbie glad to be back home with the family too tired to sleep though","direct_eyewitness"
"flown back in thru cyclone debbie and flying back out again shortly thru her but i a still smiling lovemylife","direct_eyewitness"
"right now getting the heavy rain from ex tropical cyclone debbie very heavy rain and backyard flooded its going to be a do nothing day","direct_eyewitness"
"schools are closed all across brisbane yay those who have struggled from cyclone debbie we are here to help cyclonedebbie stormseason","direct_eyewitness"
"all ready for a big day hmm whats that cyclone debbie decided to throw a tree at the surgery das luck would","direct_eyewitness"
"winds kph right now can hear the woosh woosh of the gusts around the house mackay cyclonedebbie tcdebbie","direct_eyewitness"
"helenantrobus thanks all is well although we are getting the tail end of cyclone debbie tonight","direct_eyewitness"
"our fire alarms keep going off but its literally bucketing rain and we took the batteries out look up cyclone debbie im so confused","direct_eyewitness"
"currently trapped in cyclone debbie ive seen many hurricane seasons in miami but this is scary no buses in or out stay safe everyone","direct_eyewitness"
"cyclone debbie has made her way down to where we are n n n","direct_eyewitness"
"wow cyclone debbie sure is a bag and a half of wind power flicked off and on then going now","direct_eyewitness"
"i blame all the rain today on cyclone debbiend","direct_eyewitness"
"extropicsl cyclone debbie is officially here d d d","direct_eyewitness"
"hey no school in brisbane because of cyclone debbie","direct_eyewitness"
"the current weather for me cyclone debbienow a tropical storm hence no stream til flash floodingpower outages amp","direct_eyewitness"
"one of the spots where you can get good phone reception on hamiltonisland at the moment cyclonedebbie tcdebbie","direct_eyewitness"
"schools cancelled today due to aftermath of cyclone debbie","direct_eyewitness"
"adventure time chasing cyclone debbie cyclonedebbie middle creek","direct_eyewitness"
"youknowyoureaustralianwhen school gets cancelled because of rain from cyclone debbie","direct_eyewitness"
"going back to home after school gave holiday due to cyclone debbie childish happiness hehe","direct_eyewitness"
"ready for job interview yes ready to deal with huge downpour thanks to ex cyclone debbie no","direct_eyewitness"
"thank u cyclone debbie for closing the university","direct_eyewitness"
"cyclone debbie is so severe that they had to shut down literally the whole of my state queensland","direct_eyewitness"
"im just tryna go for a walk and get a coffee but its cycloneing outside a","direct_eyewitness"
"dear cyclone debbiefuck off were over you now","direct_eyewitness"
"cyclone debbie is a crazy betch but she got campus closed so i cant complain","direct_eyewitness"
"only in australia winds of kph and this dickweed goes surfing i meansure the swell is good but check the brea","direct_eyewitness"
"got sent home from work the gold coast is flooding quick hope our pool isnt flooded seqld tcdebbie","direct_eyewitness"
"tanamongeau be careful babe we flooding real bad thx cyclone debbie ac c","direct_eyewitness"
"well now we have floods debbie done us all in qldnsw i hope you are safe i hope you stay safe dont","direct_eyewitness"
"hope cyclone debbie kills everyone at my school including me","direct_eyewitness"
"annnnndddddd the power went out cyclone debbie strikes again","direct_eyewitness"
"uni classes are all canceled today due to cyclone debbie amp monsoonal rainstyphoons ad","direct_eyewitness"
"dead bull shark washes up in severe floods","direct_eyewitness"
"so the aftermath of cyclone debbie hits south east queensland rain like we havent seen in some time cyclone","direct_eyewitness"
"two days in a bathtub to survive cyclone debbie cyclonedebbie","direct_eyewitness"
"yeah we survived cyclone debbie so glad we are sheltered everyone is happy","direct_eyewitness"
"also i think tcdebbie has already hit brisbane","direct_eyewitness"
"ya so looks like ill be swimming everywhere for the next few days shout out to excyclone debbie","direct_eyewitness"
"from the posts im reading back home on the sunshine coast the defects of cyclone debbie are pretty dramatic","direct_eyewitness"
"im pretty that bull was already upstream","direct_eyewitness"
"on the tail end of cyclone debbie we were expecting to evacuate houses this morning yet woke up to this wtf austra","direct_eyewitness"
"just gone thru cyclone debbie made a bit of a mess in moranbah","direct_eyewitness"
"hello tony im george i live in brisbane and tonight cyclone debbie was a category and she was a category the","direct_eyewitness"
"alttheman we have over k customers without power due to the heavy thunderstorms and are still assessing damage debbie","direct_eyewitness"
"good roundup here sad to announce golf club trivia is also cancelled tonight our opposition are probably stoked","direct_eyewitness"
"this is why you should avoid driving if you can in wild weather whats left of the road on sarina range tcdebbie","direct_eyewitness"
"myriad is still on be careful in getting here following heavy traffic tcdebbie qldflood qldweather","direct_eyewitness"
"so scared cyclone debbie is hitting so hard on us today n school cancelled thank goodness we werent flooded in a","direct_eyewitness"
"sitting in the dark amp feeling a bit bummed out that i wasnt able fly down to myriadlive today due tcdebbie nopower flightcancelled","direct_eyewitness"
"crazy weather right now from ex cyclone debbie this is just around the corner from our place","direct_eyewitness"
"ex tropical cyclone debbie on my door step rn","direct_eyewitness"
"banquozghost is this leftover from debbie she is quite naughty floods i got used to when i lived in wauchope","direct_eyewitness"
"wishing all of our emergency services the best of luck in what will no doubt be a long day tcdebbie","direct_eyewitness"
"jodiegunders actually owns wedge gumboots and i am about to thoroughly enjoy wearing them to the wet toowoomba sho","direct_eyewitness"
"tcdebbie i survived tcdebbie i didnt watch any tv news this week","direct_eyewitness"
"i left north queensland because of this kind of weather i feel like the biggest idiot in brisbane bnestorm bneweather bnewet tcdebbie","direct_eyewitness"
"im stuck at home with three kids today in flooding rains due to the delightful cyclone debbie so i have a","direct_eyewitness"
