"text","class_label"
"women and school going girls are most affected by climate changes eg flooddrought and famine we should come up wi","dont_know"
"does my memory linger and flood the room for you like when i m alone and i ve thought of you","dont_know"
"we are currently live with our flood risk webinar by sarah perera from mottmacdonald its still not too late to j","dont_know"
"shawdy bad afi just wanna flood her cash app","dont_know"
"newprofilepic im a yiff account now yall better watch out because there will be a flood of yiffs","dont_know"
"flood it out","dont_know"
"mr jines loves that gregabbotttx is fighting to secure the border lower taxes and he cares about flood control","dont_know"
"samwisemosher all the right ones are waders for that flood you must be very confused","dont_know"
"flood the streets","dont_know"
"tanjaeder qikipedia i know people who would love to be washed away in a flood of booze but if it were actual","dont_know"
"where gonna escape the flood and dont die and epic minigames via youtube","dont_know"
"i wind and hurricane the stormy sky and rain when you run dry i ll flood your pain","dont_know"
"since our freedom was null and void in i suggest we flood the timeline with the hashtag nationalblackkickbackday","dont_know"
"lemme flood that basement as a friend","dont_know"
"tryna flood the chain wit an lf piece d adnd","dont_know"
"okay so wow i miss having awd and flood lights on my car the drive to work was a death sentence","dont_know"
"however if alistair looks like he did in inquisition i am prepared to flood my hometown","dont_know"
"my dad is the so loving and extraaaa lol i was scared that go in my garden at night n he said he d grab a flood lig","dont_know"
"a flood of blood to the heart","dont_know"
"check us out on sonoran living live this morning showing off our interactive flood simulator befloodsmart","dont_know"
"stolencarrsa tumisole reamannya who opened the flood gates on this thing guns and explosives must be on sale","dont_know"
"print cirry tail mitten bagon flood prupure","dont_know"
"meanwhile developers are continuing to build in the yearfloodplain but whatever","dont_know"
"when the enemy shall come in like a a flood the a spirit a of the lord shall lift up a standard against him isaiah","dont_know"
"so yesturday not only did harry flood the kitchen and when i say flood i literally mean water everywhere on the electrics the lot","dont_know"
"curvedigital hi any plans on porting the flame in the flood to ios","dont_know"
"was about to flood it honestly","dont_know"
"not one raindrop thinks it caused the flood","dont_know"
"just awoke from a dream i was on a bus traveling in the rain and it was flooding overflow change growth","dont_know"
"repadamschiff kremlintrolls repswalwell is there a phone number for the committee how can we flood them with ca","dont_know"
"can i flood u with random maine gifs happystmaineniversary","dont_know"
"people n states impacted by tornado amp flood damage should sue trump some of he money he is demanding a self tr","dont_know"
"flesh flood warning","dont_know"
"i wanna make some mistakes i wanna sleep in the mud i wanna swim in the flood i wanna fuck till im done","dont_know"
"when im taking summer off amp my lil man is his dads i flood my brother with got memes to pass the time momlife got sorrynotsorry","dont_know"
"davidfrum wall street and the chamber of commerce have spoken america needs a flood of new unskilled labor","dont_know"
"this better not be florida bc that shit gon flood","dont_know"
"there is no way the pyramids of egypt could have survived noahs flood if it happened like the bible claims","dont_know"
"ok we are proud but don t flood the comments with got let s not be that type of fandom","dont_know"
"democrats certainly take their time acm left in years waiting for the berkeley pit to flood the flats","dont_know"
"your presence is a flood and i m caught in the wonder you have taken me over you have won my heart","dont_know"
"messi on the right wing and they flood the ball over and over again to some scrub on the left","dont_know"
"patrici obama and hillary took out quaddafi on george soros orders so that he could flood europe with wave","dont_know"
"me as a youth in houstontx flood waters didnt think of snakes frogs diseased water etc the love and","dont_know"
"slow water leaks can be equally as damaging as any major leak or flood major leaks or floods are usually pretty di","dont_know"
"flood re maps path to future affordable household flood insurance","dont_know"
"foxbusiness speakerryan unless you flood the market with low wage earners this is the time to get people off pub","dont_know"
"how fucked up is the american healthcare system that as these bills flood in im kicking myself for going to the","dont_know"
"whats your planopen the flood gates tell us exactly what you wantwhats the answer","dont_know"
"ride the wave of traffic join nowrn","dont_know"
"please dont flood please dont flood please dont flood please dont flood please dont flood please dont flood please dont flood please","dont_know"
"vibracy then that day the notifications flood in","dont_know"
"arkencounter what happens in the bat cave stays in the bat cave love is more powerful than a flood lovenotflood arkencounter","dont_know"
"memorial of sovereignty jesustweeters godposts teamjesus rainbow bow noah flood","dont_know"
"stuarthalloway sorry to flood you but here is what i am talking about","dont_know"
"dylanbyers hope the flood gates now open and career goes womp womp","dont_know"
"so is this the year we flood out and go extinct or will it stop raining","dont_know"
"highprecision automated reconstruction of neurons with floodfilling networks","dont_know"
"that murky ass flood water","dont_know"
"i love my phones quality also love that the flood wall is a minute walk from my apartment blessed richmond fl","dont_know"
"if realcj ken griffey and jeff bagwell walked into a club there would be what u call a flash flood warning","dont_know"
"elliottskycase toughandrich is there is a phone number to flood so nobody can make reports to an actual ice line","dont_know"
"man i m so lucky there s no flood here in my neighborhood","dont_know"
"father you are king over the flood","dont_know"
"queendomheartss khuxna apparently there was some star flood at playstore because of the global event reward","dont_know"
"paullewismoney soon china will flood market with inferior quality steel as we sold out on british steel knowing pr","dont_know"
"did overtime i got home charged my phone and got a flood of texts about a family member who got into a bad c","dont_know"
"labour mutineer reduced to appearance in the sun in bid to flood labour with rightwing entryists via midwalesmike","dont_know"
"thr the dems in washington don t they want to flood this country with illegals and give them benefits","dont_know"
"preparing my twitter for all the scumslaves that are about to flood my dms think youre worth it prove it","dont_know"
"mcoleen thetweetofgod may i flood your pillow","dont_know"
"lmao bubiashie is not a flood prone area","dont_know"
"wow i definitely thought he was building that to protect his house from flood water but this was even better","dont_know"
"was not prepared for the flood of emotions that came when hubby found a folder with some of penny s old drawings i","dont_know"
"flash floods scare me","dont_know"
"gonna flood yer twitter feed with sum looks","dont_know"
"shockz i am seeing more of them in the weekly new releases but not a flood as yet rwchat","dont_know"
"aceluvbot hes coming back baby dont worry when that day comes well flood him with our endless love","dont_know"
"as highpass as a floodplain","dont_know"
"yinglee lol well all my dbh will definitely go here i just made this account so i didnt flood my main tl with","dont_know"
"naks flood","dont_know"
"just looked at the membership i made a while back and had lots of memories flood in from our year of deca ahhhhh","dont_know"
"jiblotech forget the flood part what exactly was happening on the bed","dont_know"
"if the sun dont shine on me today and if the subways flood and bridges break will you lay yourself down and dig y","dont_know"
"watch out we are going to see a flood of am dram from people competing to be the most oppressed by the left eddi","dont_know"
"during the flood of noah god saved noah and his family with d animals dat wee brought into d ark sodom ampgomorr","dont_know"
"pets scared by fourth of july fireworks flood animal shelters via azcentral y tf dont peo","dont_know"
"use the flood of gdpr emails as an opportunity to rethink your email marketing advises jphautomation","dont_know"
"lrmysoccerotter my options are either fire or flood god bless the usa","dont_know"
"bradmondonyc we dont mind it as long as you are doing what you love and real with us which you are then flood our tls boo xd","dont_know"
"who knew that there was a national selfie day i shall go back to circa and post all my favorit selfies expect a flood","dont_know"
"because man before the flood could not be won by gods leniency amp patience by which anhe tried to win him aa he wo","dont_know"
"bts are thoughtful kings not only do you see it in the way they carry themselves always but their lyrics flood wi","dont_know"
"amgmedikal we go flood ur gmail","dont_know"
"teriamour the description says it needs tlc and is in flood zone i don t need that stress i like it though","dont_know"
"as long as the usgs and the media keep sticking to this nxyear flood n terminology it will remain consistently mi","dont_know"
"etc people trying to stop the flood gates at","dont_know"
"the emergency alert for a flood watch went off just as i was walking into work i think it s a sign to leave","dont_know"
"the lord sitteth upon the flood yea the lord sitteth king for ever psalms jesus god bible","dont_know"
"so we re moving out of our apartment and now the ac decides to break and flood the place","dont_know"
"abhisar sharma has graduated now he is sending tweets to pakistan contacts to flood sinister sentiments in india","dont_know"
"we will flood the streets we stand with mcfaul treasonsummit","dont_know"
"i will reunite with my dog on saturday temporarily but actually gonna flood the place with my tears","dont_know"
"flood games manipulation of flood insurance leads to repeat disasters houston chronicle","dont_know"
"when the enemy shall come in like a flood the spirit of the lord will lift up a standard of the blood of jesus christ against them","dont_know"
"so much iconic legendary throwback content i have to flood you guys with it all before i start posting my brand new","dont_know"
"fenerbahce janssen ve bas dost ile biter bu flood","dont_know"
"i shall be back to flood the tl with more ignorance soon","dont_know"
"yeah its the fourth of july theres fireworks everyone has seen some dont flood your freaking snapchat story","dont_know"
"bro flood yourself with hype","dont_know"
"justdaga hw i fit talk say ano go go like mommy saf she go kill me but accra boys you fit use the flood as excuse ooooo","dont_know"
"water heater leaking so bad its starting to sorta flood the downstairs hoo na dnd not like ive slept and i work tomorrow haha","dont_know"
"remember the story of the little boy with his finger in the dam to stop the flood the dam is breaking csa cse","dont_know"
"danarel millions from honduras mexico and el salvador flood into the country with no police what could possibly go wrong","dont_know"
"tamihoshiyama shawndnaruto jomc myirrell i confused tami how can the flood both create and not create rick","dont_know"
"since im bored ill flood your tl with my photography skills from my school trips xx","dont_know"
"what about wetlands wetlands provide water filtration flood and drought management climate change adaptation a","dont_know"
"slate people need to flood hers and lisa murkowskis phone lines like they did before the aca gopers ran on over","dont_know"
"for kim stanley robinson not even the apocalyptic flood is enough to kill capitalism that cockroach afterfantastika","dont_know"
"caulkthewagon i low key wish i hadn t read it bail support would flood in they could set up a paypal in second","dont_know"
"foxnews let the flood gates of liberal tears beginagain","dont_know"
"one day we ll be able to sit across from one another and past memories wont flood my heart like a tsunami","dont_know"
"highriver couple sue over impact flood mitigation will have on their property","dont_know"
"minjastars what the heck your mom is so cute all mine does in texts is a flood of typos bad enough to sometimes","dont_know"
"just want to point out that hill attendance only became unreliable when the ad decided to flood the hill with the m","dont_know"
"cant survive in the mud but they causing the flood","dont_know"
"biohazard cleaning trauma cleaning needle clean up flood clean","dont_know"
"did you know that only inches of moving water can make you fall pci has more flood safety tips","dont_know"
"kelloggsus since plastic straws are banned in california now why dont you flood the market with these","dont_know"
"annually coral reefs protect thousands of miles of coastlines from flood and storm surges saving humans billions o","dont_know"
"canada basketball hopes flood of talent turns tide to global success bc","dont_know"
"i might regret hoping for a suspension lol but it s better than getting stuck in the flood","dont_know"
"i think it s disgusting how the liberals caused a flash flood to interfere with the first lady s trip lol","dont_know"
"normeisen voteformenzim nytopinion exactly now is the time to flood them wour outrage mr pruitt s case d","dont_know"
"martycormack seanbakermn nws hi all it doesn t feel quite right to hit like on these posts about the flood i","dont_know"
"solar flare judgement upon the earth remember sodom and g remember gods promise to never flood the earth aga","dont_know"
"everylibrary yay nothing like annoying public officials with an email flood until they do the right thing","dont_know"
"if you want to flood the usa with drugs go ahead and try to abolish ice dont be fooled dont be an asswipe","dont_know"
"themariocorrea ashercaffe asherconcepts i dont agree with separating families but i dont care for the flood","dont_know"
"kierzofwar did you flood your house hahaha","dont_know"
"fyi albanywater and albanycityhall a buckingham pond is up over a foot the south portion of the pond near lenox ave is starting to flood","dont_know"
"skalledit mf you flood my tl with cats","dont_know"
"i hate when all these old memories flood my mind it makes me miss the people that are no longer in my life","dont_know"
"realdonaldtrump you just blew the wall up now begins the real flood of illegalsdrugs traffickingthe border pat","dont_know"
"that flood gate open and wellestablished by white men","dont_know"
"listen america is a racist nation and as a racist nation we need to flood this country with third world immigran","dont_know"
"keepfamilestogether oped the main disappointment we have regarding flotus mcallen trip is wx amp flooding cxld","dont_know"
"roses blush red sleepy horn worn olfactory mums flood hydrangeas","dont_know"
"hundreds of calls flood in as arizona launches nations first opioid hotline news da amejianews da","dont_know"
"ragnarrex breitbartlondon the liberals would eventually want to flood the us with muslims along with people fro","dont_know"
"monday toilet water flood tuesday water spout storm wednesday rearrange entire store thursday pipe explosion do","dont_know"
"flood yeniden","dont_know"
"jetblue rainydayinnyc theyre replying to your compliments to flood out my complaints they screwed my elderly di","dont_know"
"we have told you that for two yrs after watching the deliberate flood of men from africa not to assimilate but a st","dont_know"
"oliverbcampbell you getting any of that flooding my man we are good here but still on flood watch till the th","dont_know"
"spencerdoom how science disproves the flood story meteorology mythology","dont_know"
"in your tears and in your blood in your fire and in your flood","dont_know"
"imagine this you re on the verge of death and your life flashes before your eyes memories flood in including thos","dont_know"
"what do you think will your car insurance policy pay if your vehicle is damaged or destroyed by a flood","dont_know"
"then we should vote trump plain and simple killary will open the flood gates amp finish off america as we knew it","dont_know"
"sruhle mmmm nielsen and miller don t they know they can start a flood of taco trucks in every corner","dont_know"
"jeffflake pass a law you bum stop the flood of murderers rapists gang bangers and drug dealers from flooding t","dont_know"
"i expect a continued flood of state law changes to follow maybe now a business will have a clear understanding of","dont_know"
"as much as i hate attending my world literature class i can already see our room flooding already just by hearing","dont_know"
"crankywxguy looks like the flash flood watches here in sjersey are not gonna materialize","dont_know"
"greekdude theonion also it s impossible to get decent flood insurance","dont_know"
"no one raindrop thinks it causes the flood","dont_know"
"how do you take aguero off when you need a goal hook meza and perez and flood the pitch with attacking players","dont_know"
"garkonicky what are you gonna do flood me quote from predeluvian civilization","dont_know"
"danatkisson who knew youd have to flood proof your fences in western kansas lol","dont_know"
"heard she a dog when she mad so i flood her all in ice","dont_know"
"motmemes why are you ignoring the truth in the us was faced a flood of unaccompanied children from centra","dont_know"
"lynseybarber buy to let properties are going to flood the market no mortgage interest tax relief three year tenancies now this","dont_know"
"its time to flood our representatives with phone calls to protest their protection of realdonaldtrump and","dont_know"
"trump everything is obama s fault kittleman ec flood is ben jealous fault","dont_know"
"guy but dont you feel too informed with the what lagos people go through is the lagos you talk about a flooded","dont_know"
"remembering carl morrison invaluable to the world of bay area flood control and water agencies and known to never","dont_know"
"realmattcouch just a thought but we should flood cnn and msnbc with stories like these","dont_know"
"olganyc krissacrebleu orrrrrrrrrrrrrrr we could really put out the unwelcome mat and flood the streets","dont_know"
"usgs navidad rv at strane pk nr edna tx is above nws flood stage ft","dont_know"
"sandmanhq same here and with only days left its time to flood this petition needs to be completed and kicked","dont_know"
"it s a tasty storm itsben flood drinking a hurricane saison by nolabrewing flying saucer draught emporium","dont_know"
"madpr good luck the flood gates have opened","direct_eyewitness"
"if anyone wants to volunteer for the flood relief my grandparents need some people mainly guys","direct_eyewitness"
"so anyway although its true theyre relatives after the flood theyre also my sisters and brothers who went to the la","direct_eyewitness"
"my family making the best out of the flood is omg my tio is driving kids around in a wheeler my other uncle is","direct_eyewitness"
"drove through a flood to get a slice","direct_eyewitness"
"amberawx at least nothing is gonna be near flood stage saidnoone","direct_eyewitness"
"emergency management needs info from homeowners renters amp businesses who suffered flood damage to personal propert","direct_eyewitness"
"today is the year anniversary of the ellicott city flood you would think the city has recovered by now but","direct_eyewitness"
"this guy had a flood in his basement how do i knowcause he was talking so loud that the whole terminal hea","direct_eyewitness"
"if anyone is in need of supplies due to this flood please don t hesitate to come by our church at bridge avenue chu","direct_eyewitness"
"fabulousfigaro neilelkes nickyebrennan do you have a flood now","direct_eyewitness"
"wife informed me all of my sports swag survived the basement flood no moldy purging today lost most of my board g","direct_eyewitness"
"it keeps raining there and there are already flood alerts what a great summer","direct_eyewitness"
"repuligion maddybailey castilloselina they had a flash flood a while back","direct_eyewitness"
"the flooding that has ravaged our neighbors and family up north was devastating weve seen the photos of homes des","direct_eyewitness"
"eliesaaab in a flood","direct_eyewitness"
"millvale flood pittsburgh my neighbor reported he had of water in his basement","direct_eyewitness"
"mmda good am po how is the flood situation at oxford cor columbia sts mtap building area thanks","direct_eyewitness"
"lord please calm this weather po and guide and help those people na super affected by the flood","direct_eyewitness"
"y all my man drove through the flood yesterday just to bring me some bbq because i was crying for it he went all","direct_eyewitness"
"lephantomwriter mmbts japjmy lukewaltham i think they re not out yet it ll might take them a week if the flood won t be gone fast","direct_eyewitness"
"flooding in ocean city maryland from my cousin alyssachez doesn t take much for it to flood down there mdwx","direct_eyewitness"
"pdxarchives my dad lost his gym shorts in that flood","direct_eyewitness"
"a dear friend recently had her apartment flooded twice most of her furniture and belongings are destroyed her re","direct_eyewitness"
"dearest family wonderous news the montrose unicorn brigade have rescued our batallion from the flood waters upon","direct_eyewitness"
"the neighborhood said they are working as a team to stay afloat some load some tie some carry and place flood","direct_eyewitness"
"she was saved from the flood and now is safe with my grandma","direct_eyewitness"
"robertleiba they were exploring the caves on foot and a flash flood cut them off","direct_eyewitness"
"nwsbrownsville hidalgo rgv flood my friend sent me the video i cant get home","direct_eyewitness"
"i can t go back to sleep knowing that my other friends aint safe bcoz of the flood keep safe fam pray pray pray","direct_eyewitness"
"guys my sister got stuck in the flood for about hours and had to walk through the water to get to us i can t be","direct_eyewitness"
"matt i found out there was a flood in pittsburg are you ok","direct_eyewitness"
"poor sean omg my heart hurts and my throat is tight after seeing his studio apartment after the flood mylblife","direct_eyewitness"
"kschase alisa meridithmcgraw flotus don t forget stilettos in a flood zone idiottrumps","direct_eyewitness"
"buckeyesgirl the fields they were playing on were starting to flood and they needed to find somewhere to hide bu","direct_eyewitness"
"to our millvale community let us know how we can help you from the flood we can put you in touch with volunteer","direct_eyewitness"
"nobody wants to tell a flood survivor after theyve lost everything that oh by the way you have to raise your","direct_eyewitness"
"the elemtary school across our subdivision has an even worse case of flooding unfortunately the afternoon batch h","direct_eyewitness"
"my aunts house is flooded she didn t have flood insurance pick up the sandbags because sewer lines bust and canals overflow","direct_eyewitness"
"kazweida they might be stuck till octoberthat is if the spot they are in doesnt flood","direct_eyewitness"
"my family s house in the valley got majorly flooded this morning my family is okay thank goodness but they can t","direct_eyewitness"
"dad died my grandpa also lost his house in a flood and was homeless with my mom my dad and mom met and were both broke and worked their","direct_eyewitness"
"even tho my bf had to drive in the flood to work yesterday and he was literally the only server there he made","direct_eyewitness"
"harolditz reminds me of how her husband told flood victims to have a good time","direct_eyewitness"
"ask your cm not to go to the us and use that money for flood relief","direct_eyewitness"
"we have arrived nadnd you d never know they had a flood a few days ago a at knoebels amusement resort","direct_eyewitness"
"about two weeks ago the home of one of my dearest friends was nearly completely destroyed by a flood it would mean","direct_eyewitness"
"i can imagine how pattseans wholl come to school from rizal and cavite today are braving the flood caused by prete","direct_eyewitness"
"please help herbert hoover hs show choir recover from the flood devastation","direct_eyewitness"
"whoreofbabylon nbcnews yeahjails better than a nursing home saw what happened in the flood in texas","direct_eyewitness"
"my godfather really prepared for a flood when he planned the apartments and his house what a genius","direct_eyewitness"
"praying for everybody in the valley no manches pinche flood","direct_eyewitness"
"so now theres flooding around the camp where kids are being held waterborne disease risk on top of everything e","direct_eyewitness"
"our crew responding to an urgent call of a flooded man cave from natural flood damage to plumbing failure w","direct_eyewitness"
"i cant meet with you today it will have to be tomorrow since my husband should be getting home from the flood that he has been working o","direct_eyewitness"
"i hope everyone s having a good day except the people who think it s nfun n to drive around the flood water to take","direct_eyewitness"
"greenbrier county doh engineer steve cole talks about road issues and flood recovery in our area","direct_eyewitness"
"all this flooding shit is crazy glad i didnt buy a haus in a flood zone n at","direct_eyewitness"
