"text","class_label"
"bertkreischer why were they in a cave where this is possible this flood did not happen in a minute this sounds fishy who is in charge","noneyewitness"
"you are right it didnt flood as much global warming has caused drastic climate changes rising sea levels etc p","noneyewitness"
"wondering how some neighborhoods get heavy flooding while people living nearby don t see a drop of rain wpxiscott","noneyewitness"
"in the middle of border coverage there was a flood rgv texas firefighters tell me theyre doing high water rescues","noneyewitness"
"sidhu bats for flood control measures","noneyewitness"
"meadow street coventry flood protection and trash screen monitoring","noneyewitness"
"ndrf teams stationed in floodprone areas of states ministry of home affairs","noneyewitness"
"tsunami hits majorca and menorca flooding shops and restaurants","noneyewitness"
"youranonnews maybe there are no basements over there it could be a flood zone","noneyewitness"
"watch heavy traffic from villamor nb at grade to edsa cubao exit due to flood hows the weather in your area sha","noneyewitness"
"resources for wv flood victims can be found here femaregion govtomblin","noneyewitness"
"class suspensions for paranaque and most of metro manila take care on the roads please continue to post flood areas","noneyewitness"
"aadnd most of nj will be under a flash flood watch from am friday thru friday afternoon as a cold front sweeps throu","noneyewitness"
"flash flood warnings for the foreseeable future as snowflakes begin melting down","noneyewitness"
"rioricotx it always flood there","noneyewitness"
"well my plans for today was cancelled because of the flood waters in houston","noneyewitness"
"there were reports of flooded roads in the oakmont verona and harmar areas","noneyewitness"
"really great to see the community come together to help a local business affected by flooding yesterday evening","noneyewitness"
"nwsbirmingham through early this afternoon well be looking at a localized flood potential across our western cou","noneyewitness"
"chitral flood toll revised down as pakistan army flies help in","noneyewitness"
"large hail possible in denver flash flood watch for colorado high country wildfire areas","noneyewitness"
"water scooter hero rescues residents from mabicho flood ajw","noneyewitness"
"current storm system stretches from minneapolis to richmond and the potomac is going to floodagain","noneyewitness"
"noufalkur hello i am bencana bot reply with flood to send me your flood report","noneyewitness"
"if any responsible person is ignoring the flood situations of nepal it means he is ignoring the whole nepal","noneyewitness"
"flash flood warning come to your phone like a amber alert","noneyewitness"
"indivisiblehou gregabbotttx you cant build a flood infastructure that will ever handle the raining in houston","noneyewitness"
"transboundary flood early warning systems have the potential to save thousands of lives across asia","noneyewitness"
"a flood warning is in effect for juneaus mendenhall valley lake and river areas at am the flood stage has r","noneyewitness"
"yerawizzrdharry there s ridiculous rainfall right now so it started with landslide and flash flood warnings then","noneyewitness"
"its not too late register by july and you can vote on the harris county flood control bond issuance harvey","noneyewitness"
"powerful texas flood leads to rescues and devastation via nbcnightlynews","noneyewitness"
"pm cow bayou near mauriceville entered a action flood stage texasflood","noneyewitness"
"it has been just under a year since many lake charles residences were impacted by flood waters associated with hurr","noneyewitness"
"fully equipped rescue teams of the ndrf stationed in floodprone areas in states as proactive measures","noneyewitness"
"rt rodydu rt teddyboylocsin for two days now no traffic sure after massive rain and flood traffic was slow but it moved all it tak","noneyewitness"
"frontier communications message to floodaffected customers any customers who have a concern about","noneyewitness"
"lightning very heavy rain over areas that have seen flooding last few days live team coverage now on channel","noneyewitness"
"first i missed the hail storm then i missed the snow and now i ve missed the flood","noneyewitness"
"m reopened after flood damage m remains closed","noneyewitness"
"its called mother nature being very upset days of torrential rain lead to texas worst flooding since hurrican","noneyewitness"
"flash flood watch issued for most of southwestern utah communities brace for storms soutah weather","noneyewitness"
"after years louisiana residents get flood protection they need editorial","noneyewitness"
"extreme rainfall causes flood in western china","noneyewitness"
"areal flood warnings remain in effect for parts of frederick va warren and shenandoah counties until pm","noneyewitness"
"flash flood in pakistan kills","noneyewitness"
"threequarters of residents happy with emergency response during flood survey says","noneyewitness"
"major announcement repgarretgraves announces one of the largest federal flood protection investments in louisiana","noneyewitness"
"article reports that though local officials must require home demo or elevation is flood damages are of home","noneyewitness"
"tasmania flood threat via skinnergj","noneyewitness"
"naturaldisastersnews pakistan flood toll revised down as army flies help in","noneyewitness"
"heavy downpours to produce significant flood threat across japan this week","noneyewitness"
"two dead in japan after heavy rainfall floods landslides force thousands to evacuate","noneyewitness"
"follow dwayne on his journey to find flood resistant communities dwaynehonor","noneyewitness"
"different areas of the plains dealing with flooding red box flash flood warning dark green boxesflash flood watc","noneyewitness"
"local ambulance company working hard to help flood victims","noneyewitness"
"more storms are headed to soutah today and they re expected to cause flash floods from beaver to stgeorge and ev","noneyewitness"
"heavy rain in the region may cause flooding as small streams are running fast amp full falling spring renick beart","noneyewitness"
"dang those look just like the tents that were used to house people that were flooded out of their homes due to hur","noneyewitness"
"ndtv latest news pakistan flash flood toll rises to the death toll from a flash flood in in pakistan","noneyewitness"
"heads up rain and flooding could be historic next week along the east coast","noneyewitness"
"us between fairplay and antero junction remains closed due to flash flood road damage from monday storm in s","noneyewitness"
"montana army national guard air force to evacuate bible school students trapped after flood washes out roads","noneyewitness"
"flash flood warning for the area","noneyewitness"
"flash flood warning na dnd in effect until pm heavy torrential th","noneyewitness"
"red river fargo is flood stage record crest fargo moorhead","noneyewitness"
"houston streets flood after heavy rains sparking memories of harvey cnn","noneyewitness"
"johnston residents who experienced flood damage to their electric panels water heaters or furnace may be eligible","noneyewitness"
"minor flooding possible flood advisory in effect for the west side of orlando through clermont and around lake","noneyewitness"
"flood washes mosque away dozens are feared dead after floods struck northern pakistan washing away a mosque","noneyewitness"
"flash flood watches have been issued in parts of mass as torrential rain hits the region gt","noneyewitness"
"negative mental health effects predicted for some wvflood survivors","noneyewitness"
"our recent paper in eguesd on planetary nature of trends in frequency amp duration of floods nassernajibi amp","noneyewitness"
"gulabkunwar ashramharidwar either it is flood or any other disaster sant shri asaram bapu ji s devotees are al","noneyewitness"
"cville and albemarle are under an areal flood warning until pm what is an areal flood warning","noneyewitness"
"morning a heavy rain and flood warning is out for osaka now go the site as below if you come to osaka tomato gh f","noneyewitness"
"join thedoublelbar for the annual ride will help local folks affected by the flood","noneyewitness"
"rescuers racing against time as rains threaten to flood cave and oxygen levels drop","noneyewitness"
"york flood bill soars past d million the problems havent disappeared just because the flood has gone","noneyewitness"
"the inundation continuesnws following flash flood guidance values to a t inwx","noneyewitness"
"active weather day leads to a flash flood watch","noneyewitness"
"local animal shelter over capacity after flood monitor","noneyewitness"
"cedar rapids obtains crucial flood funding","noneyewitness"
"advisor khurshid ganai reviews flood protection works paigaam","noneyewitness"
"pm radar shows decent coverage of showers and thunderstorms localized heavy rainfall and flooding will be p","noneyewitness"
"flash flood warning for the area remember turn around dont drown","noneyewitness"
"heavy rain flood disrupt life in china","noneyewitness"
"a flood can happen at any time and it takes days to get insurance are you prepared","noneyewitness"
"traybills now that im thinking bout it aampt said it was starting to flood so that is probably why","noneyewitness"
"hang on pittsburgh and kyoto so sad two of my favorite cities are suffering from water disaster right now stay dry friends flood","noneyewitness"
"damn seeing these flood videos in hbg","noneyewitness"
"post update assam flood situations turning disastrous in charaideo assam floodsituation","noneyewitness"
"pdchina daaddn used to be known as chinas sorrow now heavy rainfall and flooding can strike the entire country without warning","noneyewitness"
"belkinsamuel waiting for the cave to flood doesn t seem like the best plan","noneyewitness"
"govt school batpora submerged in flood a water","noneyewitness"
"the recent flooding has provided a glimpse at the natural cycle of a resaca and given the historic matamoros to poi","noneyewitness"
"a flashflood warning has been issued for friday for areas around the burn scar of the fire according to the n","noneyewitness"
"yikes some nasty storms in sandusky county bellevue got a little beat up also reports of flooding there as wel","noneyewitness"
"wow actual underwater video footage of taneycomo flood damage cleanup ozarks water watch beaver table rock","noneyewitness"
"a flash flood watch is in effect for hardy shenandoah page rappahannock and southern fauquier counties until","noneyewitness"
"harvey was more of a flood event than a wind event resulting in an enormous number of cars in the houston area be","noneyewitness"
"kids found dead missing in anambra flood","noneyewitness"
"ocean co sheriff severe thunderstorm warning and flood watch in place until am please monitor the weather to","noneyewitness"
"kimberlymanns terrylellis southern texas had another flood after days of rain","noneyewitness"
"if flood waters have covered a garden most produce will be unsafe to eat several factors determine the safety of","noneyewitness"
"houston streets flood after heavy rains sparking memories of harvey news","noneyewitness"
"the severe storm in wake county is also dumping heavy rain theres a flash flood warning in effect until pm t","noneyewitness"
"helped nearby drivers by reporting a flood on i w dallas on waze drive social","noneyewitness"
"a flood warning is in effect for manatee river with more rain in the forecast saranealeigh","noneyewitness"
"heavy rain could cause flooding starting early friday morning","noneyewitness"
"flash flood warning franklin county ma until pm thunderstorms wx mawx rain flashflooding","noneyewitness"
"even as the heavy rain has moved out watch for areas of flooding in western rockbridge county near rockbridge bat","noneyewitness"
"memorable moments from houstons july th flood","noneyewitness"
"rvastreetmedia julild and california still doesn t have proper flood controlboth your states are at fault not the federal goverment","noneyewitness"
"everybody is saying pray for the rgv cause of the flood but what y all really need to pray for are all the pets do","noneyewitness"
"i considered moving to houston glad i didnt that city floods too often","noneyewitness"
"heavy rain floods areas north of flagstaff news azwx monsoon","noneyewitness"
"severe flood situation alert for public issued by central water commission weatheralert floodalert newdelhi","noneyewitness"
"planning for delivering flood resilience at scale zurich phase with partners floodalliance concern planglobal","noneyewitness"
"tropical storm warning cancelled govguam back to normal operations flash flood watch still in effect go to","noneyewitness"
"widespread flooding in texas following days of heavy rain nearly inches in hours grandsolar","noneyewitness"
"flash flood warning for parts of monroe marshall and wetzel counties until pm","noneyewitness"
"what flash flood warning in western pa that never happens","noneyewitness"
"intense thunderstorms across bc interior flood roads cut power spark fires","noneyewitness"
"new flash flood warning in effect until pm up to inches of rain has already fallen and more continues to","noneyewitness"
"flood warning for mendenhall river due to a glacierdamned lake outburst river was near flood stage at am th","noneyewitness"
"flash flood warnings in new mexico i hope the monsoons poor bring it goddess of rain we need water","noneyewitness"
"flash flood nears west frankfort homes","noneyewitness"
"darlenedejohnet that s a normality if florida it rains a lot in the summer streets everywhere can flood","noneyewitness"
"one main area seeing significant increasing trends in flood frequency since is the midwest a region that is a","noneyewitness"
"family rescued after van gets stuck in flood off apopka vinelandfox foxnews","noneyewitness"
"bike rider and passenger swept away by flood in the twinkling of an eye in enugu as onlookers watched in horror","noneyewitness"
"brooooo all these tweets about the flood are killing me","noneyewitness"
"tamilnadu can choose any water level safe for mullapperiyar dam but its needed to make sure flood in kerala is not","noneyewitness"
"as sea levels continue to rise more and more homeowners will need to consider purchasing flood insurance which i","noneyewitness"
"after flood waters broke down her garage door and flooded entire basement woman on the news says god is good wow","noneyewitness"
"binance is on fire collecting for flood a victims","noneyewitness"
"body found in wash in southwest valley could be third flood victim googlealerts givingeveryday","noneyewitness"
"those staying in hiroshima city now watch out emergency announcement from the cityflood landslides dangerous","noneyewitness"
"rain has been coming down often and heavy over the middle parts of vermilion county creating areas of flooding up","noneyewitness"
"nepal flood wake up call for effective preparedness and response reliefweb","noneyewitness"
"jhelum crosses flood mark in srinagar the tribune srinagar news","noneyewitness"
"heavy rain in nw and central portions of the county is causing localized flooding use caution when traveling tadd dfwwx","noneyewitness"
"lmao i hope y all don t flood over again","noneyewitness"
"i heard houston starting to flood again ima have reconsider moving there fr","noneyewitness"
"under a flood watch for the next hours its not raining sooooooo","noneyewitness"
"dash cam footage shows cars wading through flooded road in tu via wlivenews kent royaltunbridgewells flood","noneyewitness"
"investing in bamboo to curb floods in kenya mail amp guardian mail amp guardian investing in bamboo to curb floods i","noneyewitness"
"it may be sunny outside but engineers are working hard to protect the uk from flooding this winter learn more in","noneyewitness"
"nearly a year after hurricane harvey s floods houston libraries remain closed a some indefinitely by alysonward","noneyewitness"
"when heavy rain come after a severe drought many areas can be prone to flooding such as texas is currently experien","noneyewitness"
"fayemi receives certificate of return osinbajo visits katsina flood victims","noneyewitness"
"photos high water rescues take place as heaviest rainfall since hurricane harvey floods texas","noneyewitness"
"another morning another flooding rain event in jersey","noneyewitness"
"weather flash flood warning in effect through midnight for most of region as storms bring potentially heavy downpo","noneyewitness"
"in pictures heavy downpour causes streets to flood in lahore","noneyewitness"
"at any given time hardly anyone at all cares about flood risk","noneyewitness"
"heavy rains flood houston streets","noneyewitness"
"million announced for cedar rapids flood protection","noneyewitness"
"some greenspointarea flood victims face a crippling choice water","noneyewitness"
"areal flood warnings remain in effect for parts of frederick va warren and shenandoah counties until pm","noneyewitness"
"wide area flood left dead evacuees and mud debris short to mid term economic depression in this area","noneyewitness"
"na dnd route charleston road is closed in the block due to flooding this is just north of walton never att","noneyewitness"
"flood hits several areas in ileife in osun state property worth millions of naira were destroyed by the flood tha","noneyewitness"
"stormtracker updatepm need to be very carefulflooding is occurring in and around albany another are","noneyewitness"
"thursdaythoughts parts of pittsburgh reeling with flash floods landslides and power outages due to severe stor","noneyewitness"
"floodwaters in houston primary floodway buffalo bayou have fallen to near normal levels but have left behind mu","noneyewitness"
"heavy rains trigger flash flood emergencies in south texas","noneyewitness"
"killed in pakistan flash flood buy cheapgames","noneyewitness"
"there are risks of disasters due to heavy rain please pay attention to river flooding and landslides in particular","noneyewitness"
"new york water flood will reach the very top of all trump building nothing will remain of his name forever","noneyewitness"
"when need more action on drug companies we need the white house to stop the flood that kill missouri emergency fun","noneyewitness"
"calgary flood years later a tracking the money global news","noneyewitness"
"spot along i flooded by heavy rain","noneyewitness"
"people cussing others for showing their support to army for flood relief operations on account of its theirr job go","noneyewitness"
"heartlandoncbc doesnt surprise me that the flood brought the community closer together im also not surprised th","noneyewitness"
"nea heavy rain expected over many areas of sg from hours to hours issued hours sgflood","noneyewitness"
"us army corps of engineers said some breckenridge homeowners will need flood insurance due to internal drainage i","noneyewitness"
"the missouri river in williston is expected to rise through the week and reach major flood stage of feet late sa","noneyewitness"
"the nwscharlestonsc warns of flooding of lowlying or poor drainage areas today into this evening for coastal area","noneyewitness"
"bodies of the okada man and passenger swept away by flood today recovered in enugu graphic a photos","noneyewitness"
"where the flash flood watch was not issued in ocean county there is a flash flood warning lol","noneyewitness"
"pak army continous rescue opr in chitral after flood hit chitralreliefefforts","noneyewitness"
"chelseahandler flotus and she didnt go to a detention center the white house canceled due to a flash flood s","noneyewitness"
"phd student geogrisk in bolivia presenting findings on glacier change amp glacial outburst flood risk time for a be","noneyewitness"
"breaking another major flash flood event in the flagstaff az area with over of rain estimated over large area","noneyewitness"
"houston upping the flood game pittsburgh has floating dumpsters","noneyewitness"
"cnn flood washes mosque away dozens are feared dead after floods struck northern pakistan washing away a m","noneyewitness"
"flash flood watch in effect till midnight for carroll county","noneyewitness"
"it is never safe to drive or walk into flood waters areal flood advisory in effect for baker nassau and duval co","noneyewitness"
"houston streets flood after heavy rains sparking memories of harvey","noneyewitness"
"drawfouralan fmghost artwall icrbthomas the flood covered an area roughly larger than the state of californ","noneyewitness"
"in houghton today meeting with residents to hear and see firsthand the flood devastation a beautiful city with r","noneyewitness"
"northeast floods sikh volunteers lend a helping hand in floodhit assam via indianexpress","noneyewitness"
"imgoancrazy travel to hills is risky in rainy season himachal had many landslides and flood incidents during prev","noneyewitness"
"warnings issued in kansai and nearby areas as heavy rains trigger landslides and flooding japan severewx","noneyewitness"
"scdot reminds motorists to never drive around the barriers blocking a flooded road just inches of fastmoving fl","noneyewitness"
"aprcoffee was there coffee where it flooded it must be the best tasting flood water ever floodwaterroast","noneyewitness"
"one lake flood control supporters face uphill battle downstream","noneyewitness"
"flash flood watch as heat wave ends will weekend be beautiful","noneyewitness"
"mmda where can we see the flood reports in makati area","noneyewitness"
"mmda is there flood in magallanes","noneyewitness"
"house bill would reform and extend flood insurance program business","noneyewitness"
"residents wade through flood water after heavy rains in godhara gujarat","noneyewitness"
"a flash flood warning has been issued for allegheny county for more go to upwithkdka","noneyewitness"
"forest service warns of using flood impacted roads","noneyewitness"
"albemarle and charlottesville are under a flood warning until pm","noneyewitness"
"mmda how bout flood in makati","noneyewitness"
"heavy rain and flash floods hit pittsburgh leaving residents on alert a a full coverage","noneyewitness"
"gagood fillinusername ewerickson fun fact nearly every ancient culture on earth has a grand scale flood story","noneyewitness"
"polk county emergency management discusses scams related to flood","noneyewitness"
"southern texas has received over a foot of rain the last three days resulting in devastating flooding and forcin","noneyewitness"
"the federal government yesterday said it would give assistance to victims of a flood disaster that claimed eight li","noneyewitness"
"houston streets flood today after heavy rains sparking memories of harvey","noneyewitness"
"flood hits mosque in pakistan dozens feared dead dozens are feared dead after floods struck northern pakista","noneyewitness"
"i heard npr ask ca gov amp mo gov same question week apart new norm mo was flood ca drought its comical","noneyewitness"
"with more rain coming rescuers in thailand are racing against time to pump out water from a flooded cave before t","noneyewitness"
"flood relief centres set up in srinagar greater kashmir srinagar news","noneyewitness"
"flash flood albany western amp homestead completely flooded","noneyewitness"
"helping communities to adopt flood mock exercise as an approach to selftest the capacity to respond floods and","noneyewitness"
"fire ants uniquely form a floating raft to survive the flood waters of the amazon river they accomplish this by","noneyewitness"
"flood watch is cancelled for entire area heavy rain threat which could lead to flash flooding has pushed out of the area","noneyewitness"
"tourists in kyoto there is a great danger of flooding due to the heavy rain stay away from the rivers and the streams","noneyewitness"
"weather flash flood warning in effect through midnight for most of region as storms bring potentially heavy downpo","noneyewitness"
"continued rain prompts flood watches and warnings in western iowa","noneyewitness"
"weather alert a flash flood watch has been issued for southern utah until pm including zionnps and the brian h","noneyewitness"
"cottonwood river at new ulm expected to rise to major flood stage friday","noneyewitness"
"business stop insuring rich people who live on the coast or in flood zones at the same time stop financing fossil fuel projects","noneyewitness"
"a flashflood warning has been issued for friday for areas around the burn scar of the fire according to the n","noneyewitness"
"heavy rain floods critical care unit at indian a hospital","noneyewitness"
"sad bike rider and passenger swept away by flood in the twinkling of an eye in enugu as onlookers watched in a horro","noneyewitness"
"red rock blue diamond and mountain ranch areas under a severe thunderstorm warning and flood advisory nn","noneyewitness"
"is a massive tunnel system the answer to houston s flood woes via texastribune","noneyewitness"
"families evacuated as flash floods hit parts of cambodia xinhua kohkong preahsihanouk kampot","noneyewitness"
"heavy rainlandslideflood warnings keep coming besafe","noneyewitness"
"tas flood watch for north east catchments flood tas","noneyewitness"
"this is not flood affected area this is delhis road aftr normal rain worldclasscity totalraita","noneyewitness"
"no clue what s going on in a hotel due to flood went downstairs to get milk with mummy and this lady came out wit","noneyewitness"
"chitral rescue operation underway for flood victims read details","noneyewitness"
"evacuations are beginning on white oak mcallen flood tx texas txwx","noneyewitness"
