"text","class_label"
"my state everybody drought fire flood hail and tornados are possible in the same space at the same time you","direct_eyewitness"
"somebody please shoot me i have been breaking my back to get all of the outside yard work done before the flood","direct_eyewitness"
"its fine its all fucking fine im just a disgusting fuck ugh things were so good and here comes the fucking flood","direct_eyewitness"
"every years we face lots of losses of crop and wealth just because of flood coming from nepal what out leaders are doing","direct_eyewitness"
"insurance in this country is a scam just got a phone call denying my claim for the house damages from the flood","direct_eyewitness"
"kristenk it sucks that it only rain for hrs and most of our heavy traffic areas are flooded","direct_eyewitness"
"the other day i was with my bf we hit high water his car started to flood and the very first thing he grabbed wi","direct_eyewitness"
"it is pouring down rain so much my yard is starting to flood and there are people outside shooting off fireworks","direct_eyewitness"
"when the ocean rise and thunders roar i will soar with you above the storm father you are king over the flood i wil","direct_eyewitness"
"i think the fact that my neighborhood was one of the lucky ones that survived this flood proves that the simulation","direct_eyewitness"
"wow my alarm rings in minutes haha thanks tho i don t wanna wade in flood and leptospirosis today","direct_eyewitness"
"okay this storm is all torrential shit basement might flood dammit my epic wicked witchy weather ways may have gone too far","direct_eyewitness"
"love how my valley natives make the best out of a flood purorgv vivalaraza","direct_eyewitness"
"were a family pulled from a flood","direct_eyewitness"
"missxoh weve had storms the past week too and been in flood warnings love it i like carl","direct_eyewitness"
"i think flood waters r rising at pennsylvania ave endisnear","direct_eyewitness"
"topherspiro joltedtoad the flood is coming but it will not be mr waters","direct_eyewitness"
"my neighborhood is still flooded what a bad time to crave whataburger patty melt anyone in edinburg with a tru","direct_eyewitness"
"intoooo the flood agaaaaain","direct_eyewitness"
"what a storm here in daltonga storm rain lightning thunder flooding stormwatchon northga","direct_eyewitness"
"football league soup breaking the months the flood i watch the world","direct_eyewitness"
"mygahd theres an ankle level flood already buti nalang mataas bahay namin sa street hello stay dry and safe everyone","direct_eyewitness"
"due to the extreme weather flash flooding and dangerous lightning combined with heavy rainfall we will not be on","direct_eyewitness"
"im good in flood situations wonder if theres anything for that","direct_eyewitness"
"crazybloxdev hicrazyblox i wanted to inform you that when i was in flood escape i tried to get into easy but it","direct_eyewitness"
"y all so i just went downstairs and there s flood in our living room oooofnsjjdis","direct_eyewitness"
"so i woke up to flood entering our house rain please stop we and our dogs are already sufferinggg","direct_eyewitness"
"our basement starting to flood has finally given us a reason to clean out the storage room","direct_eyewitness"
"the rain is so heavy and our home is almost flooded the thunderstorm outside gone wild and crazy i am so sca","direct_eyewitness"
"mouseratfan chrismuellerpgh our old office was that nd floor saw it flood like that one other time about ye","direct_eyewitness"
"missoulian if only they had built some kind of large boat in anticipation of this flood","direct_eyewitness"
"my apartment definitely might flood","direct_eyewitness"
"i low key wanted my street to flood so i can go out and chill on my tube","direct_eyewitness"
"bout done cleaning out this basement flood basement shithappens","direct_eyewitness"
"please be vigilant a flash flood watch is in effect for our area through midnight tonight","direct_eyewitness"
"ive sacrificed my back twice last year cleaning up after the terrible flood in penang ajskkakdka","direct_eyewitness"
"got trapped inside my apartment today due to heavy rain and flooding still gonna try and make the most of today tho","direct_eyewitness"
"i am in a laundromat trying to clean the flood silt out of my clothing and i just realized i ve never wanted the sw","direct_eyewitness"
"the alarm in my phone won t let me sleep we ve had non stop rain this week causing floods everywhere in souther","direct_eyewitness"
"highlight of today was throwing out sentimental stuff id kept from my dad that was ruined in the flood","direct_eyewitness"
"this flood is not gnna stop me from offing myself im abt to drown myself in the puddle wish me luck","direct_eyewitness"
"today i found out that a limited edition giacometti print was ruined in a flood in my alma mater s basement archive","direct_eyewitness"
"we watch as our young hearts fade into the flood into the flood","direct_eyewitness"
"millvale flood pittsburgh some streets are open entire neighborhood is covered in dirt silt and debris","direct_eyewitness"
"had my basement flood lost all mine and my kids personal items along with my water heater furnace and ac unit","direct_eyewitness"
"my garden is ruined from flood water redrow sent someone around and he agreed that no drainage has caused the prob","direct_eyewitness"
"our parking lot starting to flood","direct_eyewitness"
"hoarsewisperer yeahand we thought heading to the flood zone in stilettos was weird","direct_eyewitness"
"heavy rain thunder floodinghave a care out there","direct_eyewitness"
"in kerala enjoying the rain and floodpeople merged with mother naturenot blaming for flood and electr","direct_eyewitness"
"okayy mother nature maybe try not to flood my whole path torrential rain a a galway galwaybaypics","direct_eyewitness"
"what do you mean i flood your basement what does that mean","direct_eyewitness"
"the flood forced my mom to make us lunch and dinner since we cant go out and buy food and wow i missed her cooking","direct_eyewitness"
"ghostgirlgrtngs construction to fix the flood damage in our place","direct_eyewitness"
"pota my early ass is gonna be stuck in flood today im sick af orayt","direct_eyewitness"
"these muthafuckas at work have the audacity to call me in early to work during a flood i swear i m going tho","direct_eyewitness"
"heavy rain down here in south texas weather weatherchannel rain texas flooding","direct_eyewitness"
"kinjikins flood always feels like crossing a river","direct_eyewitness"
"stefanoambrogi stevencroft quite right i sit on flood and resilience boards here in the sw uk we don t have t","direct_eyewitness"
"finally getting somewhere after the flood","direct_eyewitness"
"roshayyred i know lmao i totally forgot about that though damn flood surge gone take my poor house down to the ground smh","direct_eyewitness"
"sooooo my apartment decided it wanted to flood today","direct_eyewitness"
"it was such an experience walking in or through or whatever the flood in ust but also it s scaring me cause the ger","direct_eyewitness"
"my day back home in wv flash flood watch newseattle","direct_eyewitness"
"he flood waters have drained off downtown houston","direct_eyewitness"
"jassecaps you re not in a flood zone my entire neighborhood is flooded and all the roads i take to work too","direct_eyewitness"
"this flood is bringing one positive thing at least everyone is going outside and finally meeting their neighbors for the first time","direct_eyewitness"
"the aftermath of yesterday s flood in doney park azwx flagstaff azmonsoon nwsflagstaff foxphoenix","direct_eyewitness"
"jazminuribe my store is about to flood","direct_eyewitness"
"yeah i guess you can say mother earth has a crush on me she always makes my basement flood letting me know she s wet","direct_eyewitness"
"thank u universe for the flood i finally got a day off work","direct_eyewitness"
"you d think after harvey the fuckin locals would know not to drive in the fucking flood zones","direct_eyewitness"
"after hours of flood watch the rain finally seems imminent","direct_eyewitness"
"iambrittneylamb i m trying to find the gates to heaven where the flood come from out of nowhere to","direct_eyewitness"
"it just got done raining here in my community the flood alarm wasnt triggered so mustve been just a cute sprinkle","direct_eyewitness"
"suffered from flood lost baggage fire alarm s malfunctionand more i don t have good memories in hawaii bu","direct_eyewitness"
"when you try to leave town but new orleans decided to flood the highways","direct_eyewitness"
"its am im stuck in a flash flood and i have made the perfect grilled cheese","direct_eyewitness"
"fighting flood waters have to find a way for s plaza dr to drain properly casa de color cafe in evansville in","direct_eyewitness"
"oof first day of summer brings lots of rain flooding to the chicago area","direct_eyewitness"
"my local agent is not answering my call to send me a copy of my policy as mine was damaged in the flood","direct_eyewitness"
"my new hobby is watching from my office window as thunderstorms flood burton lawn once again and making jokes about","direct_eyewitness"
"it s so funny how when there s a flood flash everybodys phone goes off","direct_eyewitness"
"so im stuck in a flash flood right now almost made it home but the driveway to my apartment building is flooded","direct_eyewitness"
"sick of waking up to these flash flood warnings","direct_eyewitness"
"the flood came inside the house now we re all stuck here","direct_eyewitness"
"noah to god yepjust flood this shit bro","direct_eyewitness"
"looking at all the flood pics from last night i now feel so fortunate to come off it unscathed yeah it was blood","direct_eyewitness"
"omfg mom woke me up with flood invading our area jesus christ its raining non stop","direct_eyewitness"
"so after that flood at my place i was pretty sure my landlord threw out my sketchbook bc he thought it was ruined","direct_eyewitness"
"lucyxiv well god did flood the earth i assume that includes dip","direct_eyewitness"
"you have got to be fucking kidding me my fucking tags were stolen while its being repaired for flood damage how t","direct_eyewitness"
"oh gosh flood im hiroshima","direct_eyewitness"
"oh now the sun wanna come out after all this heavy rain and flooding toolate","direct_eyewitness"
"fuckedchic sorry for my late response i ve been rearranging my living room thanks to the flood xxx ilove you","direct_eyewitness"
"michelle bauer gives a tour of her backyard and basement flood damage of her home on thursday morning in millvale","direct_eyewitness"
"drove by my old street trying to get to work this morning to see my old street under flood waters again stay safe","direct_eyewitness"
"simonmaloy jeremymclellan there s a flood here that s pretty bad it hasn t flooded like this since hurricane beu","direct_eyewitness"
"here in utah we have had heavy rain in the southern part of the state flash flooding has caused major destruction","direct_eyewitness"
"joshgw that pic was after a flood they walked in and found that btw","direct_eyewitness"
"the street behind my house is starting to flood for the first time in years and they have my street completely blocked off","direct_eyewitness"
"an umbrella and my feet are enough to face the storm lightning and flood just to fetch you","direct_eyewitness"
"mrsjrt luckily no one died or home got flooded lots of folks got stranded lost their car in the flood waters","direct_eyewitness"
"umm i don t have time for my street to flood again","direct_eyewitness"
"hours after the great flood of wendels manor and the living room may need a few dehumidifiers","direct_eyewitness"
"take note and keep yourself safe when cleaning up after floods","direct_eyewitness"
"do we have drinks n we have a lot of water n about the flood","direct_eyewitness"
"i love that there is a thunderstorm with flood watch going on fuck your fireworks","direct_eyewitness"
"this flood is crazy i hope the rain completely stops already c","direct_eyewitness"
"i remembered the time when i first experienced flood in taft sumugod ako sa baha while crying bc i was wearing shoes then hahah","direct_eyewitness"
"i slept through a flood anyways im going back to sleep","direct_eyewitness"
"that feeling when your autographed stevegrandmusic photo was damaged in a flood","direct_eyewitness"
"definitely feels like a floodinthebasement kind of day today","direct_eyewitness"
"how s my friday going oh you know just found out i have a blown engine in my car because i got stuck in flood waters last week","direct_eyewitness"
"okay so since bad things come in threes im waiting on the third so far weve got apartment flood flat ti","direct_eyewitness"
"stoneyybolognaa i got over likes andor retweets on a tweet during that hurricane and flooding in texas many","direct_eyewitness"
"nothing new there my building on hanley road floods all the time with heavy rain","direct_eyewitness"
"the rain is starting again i m afraid it will flood the streets we go on the way to school walangpasok citypinas","direct_eyewitness"
"this flood is giving me cabin fever","direct_eyewitness"
"flash flood","direct_eyewitness"
"my whole neighborhood had a massive flood that may ruin a few homes and instead of ignoring other people s proble","direct_eyewitness"
"of course as soon as i get ready for work it decides to come a flood","direct_eyewitness"
"i just want some food but everything is starting to flood and powers out at the pizza places sos","direct_eyewitness"
"my family decided to have the cookout outside under the pavilion and it just came a flood looks like we are stuck here for a while lol","direct_eyewitness"
"the flood claimed all of our kittens amp i m so sad","direct_eyewitness"
"hosman church needs your help our ceiling collapsed due to a water flood in the apartment upstairs thank you","direct_eyewitness"
"another holiday another flood cmon mother nature we need a break","direct_eyewitness"
"dealt with a small flood this morning and now setting up my new phone streaming will be happening later tonight guys","direct_eyewitness"
"please stop trying to drive through the flood in neighborhoods you re creating waves and damaging the house","direct_eyewitness"
"yes duston i wanna swim w the fishies bc also it s pourin down rain and looks like it s a gonna flood","direct_eyewitness"
"one of my cars have been evacuated to miyama park because kurashiki river becomes flood level","direct_eyewitness"
"when the flood comes to drown us theres nothing we can do","direct_eyewitness"
"stay away from flood water","direct_eyewitness"
"the towels from my flood are still drying and my apartment smells like butts","direct_eyewitness"
"i would ask for some rain but it likes to flood every chance it gets","direct_eyewitness"
"its been raining for roughly years straight and im fairly optimistic that its gonna flood again","direct_eyewitness"
"only day two of being out in the country and i almost blew a tire while nearly getting stuck in flood water and hit","direct_eyewitness"
"karspory i had to choose between saving my life in the flood or getting a pic for the paper i chose getting a pic","direct_eyewitness"
"we had a mini flood but in return got a brilliant sky and lower humidity for a night","direct_eyewitness"
"pleasantgehman oh no we had a hell of a rain thunder lightening storm last night trees down power out flooding","direct_eyewitness"
"drop ah rain and the street flood wdmc","direct_eyewitness"
"i m so happy my neighborhood didn t flood at all","direct_eyewitness"
"ok those emergency alerts are so goddamn annoying i m switching them off for today i know there s a flood and mud","direct_eyewitness"
"gahanna going to flood if this rain keeps up the lakes in my complex are at crest and over","direct_eyewitness"
"i jus rescued a baby kitten from the flood im so sad im crying shes so cute","direct_eyewitness"
"another holiday another flood but just like always we bounce right back nadnd celebrating our troops and first resp","direct_eyewitness"
"just rained so hard my back room at work flooded and the manhole covers in the road out front popped up from the wa","direct_eyewitness"
"was literally caught in the worst flash floodthunderstorm i ve ever experienced right after the fireworks that","direct_eyewitness"
"simonscholes pretty good day except for the flood this morning inches in minutes yup pretty much everything under water again","direct_eyewitness"
"and some or most of these albums were damaged because of the flood from when typhoon haiyan hit in out city","direct_eyewitness"
"today is a joyous day days after my car died in the second ellicott city flood i finally got my car back nomorerentalcar","direct_eyewitness"
"its raining like a good old kentucky flood rain it better stop so we can go be redneck and celebrate meruca","direct_eyewitness"
"found this fish skeleton along the path that i walk it probably got stuck in a puddle after the flood stage of the","direct_eyewitness"
"yall really think this flood is gonna stop me from watching the premiere of jurassic world tmrw foh","direct_eyewitness"
"onebytwo as per vastushastra changing the name will stop the flood people will taller it will rain gold from","direct_eyewitness"
"flood it like a tidal wave","direct_eyewitness"
"ok folks in addition to the flood devastation this weekendwe have also been told today that the insurance we ha","direct_eyewitness"
"i got stuck in a car for hours on the th of july flood in this exact area we were forced to pull up on someone","direct_eyewitness"
"mightyfineline jefflemire dragonmnky blambot nottoochaby went out in a houston flood to get my copies","direct_eyewitness"
"oh not the flood zone househunters","direct_eyewitness"
"i thought the best part about the flood was getting over feet of water in my basement but surprise my car is totaled too","direct_eyewitness"
"i ve been following all the flood issues my neighborhood is fine and i don t leave for work until after but ev","direct_eyewitness"
"the same week i started working a flood came and closed down the whataburger i work at i think that s a sign i","direct_eyewitness"
"job well done despite the heavy rain our staff was able to get the medical tents moved out before the flooding at","direct_eyewitness"
"i dont know if i should be more afraid that i left my wallet in the apartment or expected flood waters to rise","direct_eyewitness"
"i saw a mustang stuck in the flood why would you bring it out take an uber lol","direct_eyewitness"
"like me amp my sister would come to school hrs late whenever we take alternative routes bcos of how bad the flood is yet here i am","direct_eyewitness"
"in preparation to the masks i just purchased was only going to replace my rey mask that i lost in the flood but","direct_eyewitness"
"thats right a flood came down to salgotarjdn a","direct_eyewitness"
"naw the house insurance people came to collect our sofas that were damaged in the flood n now were all sitting on deck chairs","direct_eyewitness"
"its been raining for days and there is flood everywhere its cold","direct_eyewitness"
"i work at roadhouse today n i m gunna make like bucks bc no one is gunna go drive in a flood for a damn steak","direct_eyewitness"
"geez this flood is so bad","direct_eyewitness"
"blackouts and flood i really wish i hadnt used up all my absences when i had the flu","direct_eyewitness"
"amp i need groceries too but its about to flood again","direct_eyewitness"
"parts of texas got a flood warning and up here in the rose i ain t seen the sun all day but y all bitching about","direct_eyewitness"
"this flood sucked but the memes were great","direct_eyewitness"
"rain water falling down with very large drops may be its comeing flood today","direct_eyewitness"
"i don t have nothing to post because my th of july is ruined by this flood houstonlife","direct_eyewitness"
"rain i hype you up all the time and you turn around and flood my newly finished basement like why you gotta do me dirty like that","direct_eyewitness"
"i am literally stuck in chases apartment complex and watching my car flood","direct_eyewitness"
"i finally left my house me this flood","direct_eyewitness"
"chanptaln go and sneak us through the rivers flood is rising up on your knees","direct_eyewitness"
"let the flood carry away all my pictures of you","direct_eyewitness"
"heavy rain it flooded our town","direct_eyewitness"
"it rains hard one day and some places flood such a lovely hole in the ground this city is","direct_eyewitness"
"woke up to the second great flood thanks god","direct_eyewitness"
"sadly houston didn t got to do a parade like every other place around the usa but we got to pray so that our houses won t flood again nd","direct_eyewitness"
"xperiablog and surprisingly it still runs perfectly its been a year since last flood and im tweeting this via the same phone","direct_eyewitness"
"dpaqreport isnt really hot it is floodraining across the entire region","direct_eyewitness"
"rain boots are a necessity i just walked through a flood in mine","direct_eyewitness"
"hi there me and others are stuck in a house in kill devil hills nc due to a massive flood anot a ton of food lef","direct_eyewitness"
"spent all morning pushing water off my patio so my crib wouldn t flood so to nikodoom for the help","direct_eyewitness"
"why am i not yet contented with suspension i want something better to stop the continous rain bcoz there are places experiencing flood rn","direct_eyewitness"
"twicetzx too flood dear aa aa good afternoon anyway","direct_eyewitness"
"not having ac in fredericton this week is more life threatening than the flood","direct_eyewitness"
"big thanks to seniors mason heckman levi hummel connor ibach and jack adam for helping with flood cleanup at coac","direct_eyewitness"
"i was in a flood years ago it was our neighbors and people of nearby towns who came to the rescue it is always","direct_eyewitness"
"it is the worst ive ever seen it flood in my entire life i should not have made it home it was the scariest shit ever","direct_eyewitness"
"the fact that it s raining in sa and austin makes me feel better about the mini flood we got today","direct_eyewitness"
"pupusamonkey montyglu not in texas right now we just got done with heavy rain that flooded a few places but not","direct_eyewitness"
"stevenraymorris i lost mine in a flood","direct_eyewitness"
"this is my mom trying to make the flash flood end so we could go to our cousins house","direct_eyewitness"
"arcade my hometown is flooding with heavy rainnd","direct_eyewitness"
"nothing like falling on the ice and getting soaked because the humidity won t let the flood dry properly seriously","direct_eyewitness"
"the flood s knee deep on my street and ankle deep in the compound omg geraldmpl can t even make it to training","direct_eyewitness"
"lights flickering even stuff plugged into the red auxiliary power outlets not staying on now i hear flash flood","direct_eyewitness"
"footworkking oh ok that s good bro i know how that flood go my hometown had ft when katrina hit and shii now","direct_eyewitness"
"sometime rain some other time the sky pours all the water in few minutes rain moscow russia summer flood","direct_eyewitness"
"fuck the rains so strong pasodifuapsidofjaijcj n i hope i dont have to wade through flood tomorrow pls lord","direct_eyewitness"
"it came all at once and in a furious torrent like god was mad and wanted to flood us out","direct_eyewitness"
"i like how i told ryder i was happy bcs it was raining and turns out there s a flood ahdksj","direct_eyewitness"
"got stuck in a flash flood n got rained on rlly bad yesterday n i think im coming up w a cold lmao genius","direct_eyewitness"
"one of my albums got wrecked by the flood","direct_eyewitness"
"theres a good chance my apartment is gonna flood again today coooooool","direct_eyewitness"
"effect of flood in my island area mahnar","direct_eyewitness"
"i too wondered if chick fil a was opened todaywell before i had to drive thru flood waters","direct_eyewitness"
"jordevos its been a long process we had a couple of appliances with flood damage and thats been difficult we h","direct_eyewitness"
"my job is in a flood zone and now i have wet socks and shoes happy th y all","direct_eyewitness"
"if we get hit by a cat hurricane rip entire rgv this flooding is crazy","direct_eyewitness"
"this is the absolute last thing my community needs right now many are still bailing out from mondays flood","direct_eyewitness"
"we face a d bill for a flood a but we didn t own the house","direct_eyewitness"
"after the flood all the colors came out","direct_eyewitness"
"oyg its a flood","direct_eyewitness"
"its been sitting right on top of my location for the last half hour big time street flooding in northern rio ranc","direct_eyewitness"
"lmao thx to yesterday s th of july flood we discovered on snapchat that the area we are moving to floods fuckin houston","direct_eyewitness"
"never seen roads flood as fast as they do in lc","direct_eyewitness"
"year ago this evening we came home from the fair to a flooded basement that quickly escalated into a flash flood","direct_eyewitness"
"when u want to go to work but the flood is inside your gate and you don t have your laptop bc you were out sick yes","direct_eyewitness"
"wow another flash flood that makes three in a row basement is flooded again but my prayers are for everyone dow","direct_eyewitness"
"one hour on the road for tonights effect of heavy rain i always took mins from the house to school due to flooded area amboph","direct_eyewitness"
