text,class_label
masiii rumah nenek aku msh banjir,eyewitness
kelantan dan terengganu dah banjir,eyewitness
depan rumah dh banjir huhu,eyewitness
mantap banjir lagi,eyewitness
rumah aku x banjir,eyewitness
ayuh main banjir haaha,eyewitness
banjir sis,eyewitness
ini cipinang banjir,eyewitness
banjir dong,eyewitness
ni punca banjir mungkin,eyewitness
banjir dah kapung bosku,eyewitness
pata timu dah mula banjir ka,eyewitness
banjir selutut orang dewasa,eyewitness
wih banjir an,eyewitness
tiati banjir,eyewitness
hujan jugaa banjiiir jugaa,eyewitness
banjir woe banjir,eyewitness
masih banjir,eyewitness
banjir dh gais,eyewitness
jangan banjir lagi aku nk balik cemana,eyewitness
hujan lebat gais banjir disini huhu,eyewitness
banjir woiiii hujan tak berhenti dari semalam,eyewitness
uih kampung aku dah banjir,eyewitness
banjir karena hujan deres kagak berhentj berhenti,eyewitness
banjir sudahhhh,eyewitness
rumah dah banjir geng,eyewitness
baru selesai beresin banjir,eyewitness
hahahahah banjir dh gang ni,eyewitness
banjir datang lagi,eyewitness
banjir banjir banjirr,eyewitness
alhamdulillah bantuan banjir dah ada,eyewitness
banjir sudah banjir,eyewitness
lagi musim hujan dan sekarang banjir,eyewitness
malang banjir,eyewitness
ujannya baru berapa jam udah banjir aja cepet amat banjirnya,eyewitness
terjebak banjir di timur stadion maguwo,eyewitness
alamak kampung dh banjir,eyewitness
orang lain keluar dari area banjir saya otw masuk kawasan banjir,eyewitness
depan rumah pun banjir gimana inih,eyewitness
anjir banjir lagi,eyewitness
hm kmpung dah start banjir dh,eyewitness
tempat saya banjir jakarta babay min,eyewitness
disini masih banjir ka,eyewitness
nah kalo kosan banjir gini kan enak jadi ada kerjaan gitu daripada tidur,eyewitness
takutnya banjir,eyewitness
lah kok banjir,eyewitness
jadi korban banjir,eyewitness
yak rumah banjir,eyewitness
banjir di jakarta,eyewitness
banjir mba di kandang rusa itulo udah segitu huhu,eyewitness
ngepel kamar yang banjir,eyewitness
banjir kita banjir sudah,eyewitness
tangerang banjir,eyewitness
kan banjir trus liwat mane,eyewitness
banjir wooooiii,eyewitness
margonda banjir pak,eyewitness
siang panas malam banjir,eyewitness
oalah tiati banjir,eyewitness
yuhuuu udah banjir lagi aja nih perum,eyewitness
banjir udah heheheh,eyewitness
ciledug banjir,eyewitness
iya jir awet pada banjir jalanan untung rumah gua ga,eyewitness
nggak enak kena banjir,eyewitness
selamat tahun baru kepada aku yg menangani banjir kontrakan di pagi hari,eyewitness
banjir mlh,eyewitness
baru kali ini ujan semaleman trs banjir udah masuk ke rumah,eyewitness
pdhl lagi banjir,eyewitness
hujannya awet banget rumah kena banjir,eyewitness
mantappp awal tahun banjir cok,eyewitness
beberes rumah kerendem banjir,eyewitness
banjir bray,eyewitness
banjir,eyewitness
kost banjir fyi,eyewitness
yak tahun baru diwarnai dengan banjir terparah sepanjang sejarah rumah,eyewitness
kalo banjir sampe seperut gini nyalahin siapa y,eyewitness
tetap nge bid walau banjir seleher,eyewitness
pamulang udh mulai banjir di jalanannya bg ene moga ga masuk rumah ya,eyewitness
iyaa udah banjir malahan,eyewitness
rumah gue udah banjir,eyewitness
semoga baik aja yang kena banjir,eyewitness
sama nder lg banjir jg,eyewitness
banjir banjir ulala,eyewitness
aku dicikarang banjir,eyewitness
bersihin rumah dari banjir min,eyewitness
gimana mau berangkat ini kalo dimana banjir,eyewitness
woi balik lu ponbar belakang banjir daleman tuh,eyewitness
banjir banjir banjir datang lagi sayang,eyewitness
woy ini banjir,eyewitness
oke ternyata realisasi nya lebih liar depan kosan udah banjir,eyewitness
yaallah pagi baru bangun kaget rumah tiba udh mau kemasukan air banjir,eyewitness
ini semuanya pada apdet banjir meanwhile di sini ngga ujan samsek bruuh,eyewitness
banjir pokoknyaaa wkwkw,eyewitness
jalan raya banjir,eyewitness
udh banjir mati lampu pula,eyewitness
hujan deras banjir mati lampu pula,eyewitness
alhamdulillah kita dikasih ngerasain banjir diawal taun,eyewitness
ya allah semoga tidak banjir,eyewitness
gabisa nonton rumah banjir coy sedi bat,eyewitness
pusing anj banjir,eyewitness
banjir,eyewitness
banjir bangetttt ini masuk rumah,eyewitness
om om tolong ini banjir,eyewitness
ujannya makin gede njir banjir,eyewitness
banjir u jgn berenang y ra,eyewitness
wedeh jekardah banjir,eyewitness
banjir dong depan rumag gua ujan dari kmrn sore gua tidur kebocoran,eyewitness
tahun baruku di sambut oleh banjir,eyewitness
belom tidur ehh malah banjir perumahan gue terus aing kudu piye,eyewitness
ujannya kaya gini sih jakarta auto banjir,eyewitness
aamin rumahku juga banjir,eyewitness
semoga lekas surut banjir airnya yaak,eyewitness
semoga hujan cepat reda dan banjir cepat suruh,eyewitness
banjir lagi dah wkwkwkw,eyewitness
wkwkwkwk belom tidur ni grgr banjir,eyewitness
nih jekardah banjir,eyewitness
lah kamar gue banjir,eyewitness
scratch that ga jadi kerja gara gara banjir,eyewitness
banjir sumpa,eyewitness
rumah gue bekasi timur banjir bandang,eyewitness
yummm rumah gue kemasukan banjir pdhl biasanya engga hujan di sana awet bgt ga sih,eyewitness
waaahh banjir juga,eyewitness
mengawali tahun baru dengan banjir,eyewitness
rumah gue banjir,eyewitness
banjirrrr banjir btw dingin ya,eyewitness
waduhh waduhh banjir dah nihh banjirr dahhh,eyewitness
pertama kali merasakan banjir jakarta tahun,eyewitness
daerah rumah gua banjir,eyewitness
banjir gais,eyewitness
banjir didepan udah meter ya allah,eyewitness
paraahhh banjir parah,eyewitness
banjir pak,eyewitness
rumah gw banjir asu,eyewitness
banjir gini kepikiran nasi uduk jadi laper,eyewitness
banjir gaesss,eyewitness
rumah aku uda kemasukan banjir tinggi bgt soalnya grgr ujan gaberenti huee,eyewitness
jadi hujan yang menyebabkan banjir sekarang adalah yang terburuk setelah lebih dari tahun lalu,eyewitness
bekasi banjir dimana mana hiks,eyewitness
bli banjir bli disini,eyewitness
eh eh eh kok mulai banjir lagi sih dimana mana,eyewitness
kali kayuringin banjir para gais jadinya macem gor gitu gitu tenggelem se pinggang,eyewitness
hujan deras mengakibatkan banjir,eyewitness
kerumah gw aja gratis mumpung lgi banjir,eyewitness
banjir sis,eyewitness
korban banjir di awal tahun malah banyak ya termasuk rumah ini,eyewitness
rumahku banjir rumah kalian banjir gk nih,eyewitness
wew bangun depan rumah banjir mati lampu,eyewitness
kenapa banjir sih,eyewitness
ya allah semoga daerah kosan ga ikutan banjir,eyewitness
banjir,eyewitness
banjir dah,eyewitness
pantesan kucing gue diem aja ternyata banjir dia takut airkan biasanya ngeong mulu,eyewitness
banjir banjir banjir datang lagi sayanggggggg,eyewitness
bener kan tuh kostan gue banjir ah sinting bagaimana nasib barang bucin gue,eyewitness
berdoa makanya biar ga banjir,eyewitness
gegara banjir langsung radasss,eyewitness
jangan sampai banjir,eyewitness
kelelep banjir,eyewitness
sudirman dah banjir wakakak dah lah aku ngakak wae,eyewitness
tahun baru banjir,eyewitness
ujannya udahan dulu ya allah baru kali ini banjir sampe masuk rumah,eyewitness
bangun pagi disambut banjir,eyewitness
maap aku ketawa liat ini pdhl sama depan rumahku banjir,eyewitness
sampe banjir semoga cepet surut ver,eyewitness
rumah gua banjir wei,eyewitness
kaget anjir lgi tidur dibangunin gara gara banjir,eyewitness
baru balik ke rumah dan jalanan banjir,eyewitness
banjir help,eyewitness
gak suka ya kalo banjir gini bau kecoa,eyewitness
kirain lagi ofroad ternyata banjir yak wkwk,eyewitness
udah masuk rumahku ini banjir,eyewitness
banjir jan wkwkwk,eyewitness
jam tadi gara gara banjir,eyewitness
jembatan total persada sudah banjir selutut orang dewasa,eyewitness
tauunbbaruan banjir asiap,eyewitness
alhamdulilah banjir,eyewitness
daerah w banjir dong,eyewitness
jam sore sampai sekarang masih blum reda hujan taun baru disambut banjir,eyewitness
banjir banjir,eyewitness
gw disambut banjir niel boro nungguin dispet,eyewitness
pdk surya mandala jakamulya bekasi banjir setinggi cm,eyewitness
kalau ujannya gak berenti fix rumahku akan banjir dikit lagi,eyewitness
bekasi ku knp macet bgtttt ak jarang keluar sekalinya keluar kejebak banjir hfffffff,eyewitness
banjir banjir,eyewitness
jakarta banjir lg ni doakan manteman smg selamat,eyewitness
pln komplek gua ga banjir gausah di matiin listrik nya,eyewitness
first day of alhamdulillah sekitar rumah masih aman ga banjir,eyewitness
eh tolong kebelet pup gimana ini kamar mandi gue aja banjir,eyewitness
laper tapi ga bisa keluar karna banjir,eyewitness
banjir,eyewitness
bekasi juga banjir euy,eyewitness
banjir zzzz,eyewitness
smg banjir segera surut bisa kembali ke rumah,eyewitness
banjir disini,eyewitness
tangerang gak banjir euy manteb padahal deres dari semalem sampe sekarang,eyewitness
pondok gede bekasi bang banjir selutut,eyewitness
banjir udh sepinggang apa kabar mobil gua ya,eyewitness
depok suda banjir,eyewitness
jalanan depan kosan udah banjir ternyata,eyewitness
awal tahun dibuka dengan banjir,eyewitness
setelah sekian lama kampung gua banjir lagi,eyewitness
mau foto mobil kerendem banjir tapi ga tega,eyewitness
gakbisa masuk komplek grgr banjir mantap tidur dalem mobil depan indomaret,eyewitness
bekasi banjir kak,eyewitness
tahun hidup baru kali ini banjir sampe masuk rumah,eyewitness
banjir dan mati lampu komplit sudah,eyewitness
banjir min,eyewitness
ya allah jalanan dibawah rumah yg biasanya ga banjir ini banjir udah se dengkul,eyewitness
pagi pagi bangun tidur menikmati banjir,eyewitness
banjir gais mana brg blm di taro atas smwa,eyewitness
lama lama kosan bisa banjir nih,eyewitness
first time in forever banjir sampe masuk rumah,eyewitness
ada yg rumahnya banjir rumahku korban gais,eyewitness
kemudian rumahku kena banjir sampe kedalem moga buku perpus ga kehanyut,eyewitness
banjir jugak rumah aku ni kang,eyewitness
banjir woi,eyewitness
selamat tahun baru tahun baruku banjir,eyewitness
banjir pertama waktunya indomie,eyewitness
gue suka musim hujan tapi gak sampe banjir gini ya tolong,eyewitness
banjir terparah dari semalem sampe skrg ujan belum berenti ga kebayang yg rumahnya biasa banjir,eyewitness
banjir,eyewitness
wah pertama kalinya kamar mandi gue banjir biasanya gapernah,eyewitness
ka icha akan menjadi putri duyung kesekian kalinya kena banjir mulu,eyewitness
jakarta banjir ni,eyewitness
foto banjir di rumah,eyewitness
bangun depan rumah banjir anjirr,eyewitness
tempaku juga udah mulai banjir teh,eyewitness
page baru juga pagi udah banjir sampai rumah ajaa,eyewitness
jakarta hujan udah sekitar jam langsung banjir,eyewitness
tangerang sdh banjir kang,eyewitness
rumahku juga terjebak banjir,eyewitness
gabisa nonton rumah banjir bye,eyewitness
keknya baru ini banjir,eyewitness
ujan lebih dari jam bikin banjir bgt,eyewitness
wkwkwk perumahan gua aja banjir cui,eyewitness
ini langganan banjir emang,eyewitness
jakarta banjir just info,eyewitness
baru bangun basah ternyata banjir asw,eyewitness
yang bikin tambah panik ketika banjir adanya ular,eyewitness
sialan gua ga open house buat banjir,eyewitness
ini kok pada banjir rumahnyaa,eyewitness
bengkulu jga banjir,eyewitness
banjir gan,eyewitness
udah nggak pernah banjir sekarang kena banjir lagi,eyewitness
bangun bangun banjir,eyewitness
memang klo musim penghujan pasti srlalu banjir,eyewitness
ternyata banjir rumah gue belum seberapa,eyewitness
woke up in and tadaaaaa depan rumah banjir wkwk,eyewitness
ga berenti ujan sama banjir,eyewitness
guys rumah aku banjir se setengah paha hskahsksjs panik tp kocak anjir,eyewitness
baru tinggal bentar udah kena banjir,eyewitness
banjir semeter udah disini,eyewitness
wadoh sayang bet banjir,eyewitness
sabar ibuku mas sedang berjuang mencari jalan yang tidak banjir,eyewitness
disambut dengan banjir,eyewitness
banjir ga bisa pulang kayaknya,eyewitness
terpantaw banjir dah selutut binsar panjaitan,eyewitness
aku tangerang sampe sekarang masih ujan banjir juga,eyewitness
bisa bisanya hari pertama langsung banjir,eyewitness
banjir kak,eyewitness
banjir semoga hujan dan banjir segera reda,eyewitness
gue bangun jam tadi ngerasa basah gue kira gue ngompol ternyata banjir,eyewitness
rumahku banjir,eyewitness
hujan banjir dikosan sendiri ga ada air oke mantap,eyewitness
kaki ampe mengkerut mo balik pulang jalan kaki jg lumayan bgt banjir gini mah,eyewitness
sianjirrr untung rumah gua blm masuk banjir jangan sampe dah,eyewitness
iya nih jam pagi tuh belom banjir loh net jam pagi tiba udah sebetis dalem rumah,eyewitness
banjir di bekasi moga cepet surut biar sabina bisa main,eyewitness
banjir se betis,eyewitness
grgr banjir kecoa mati betebaran anjiran,eyewitness
gila sampe banjir ini depan rumah,eyewitness
mati lampu banjir udh hmpir seatap ujannya msh gede bgt ya allah mau nangis,eyewitness
ya allah baru jam sudah banjir di jakarta min,eyewitness
banjir,eyewitness
wah banjir,eyewitness
ya allah banjir,eyewitness
ya tuhan ga pernah banjir terus hari pertama sung banjir gini,eyewitness
ehh di blok b sama blok a ga banjir tauuuu,eyewitness
yaampun di daerah kalian banjir gaa di daerahku banjir sampe masuk rumah ak terjebak di kasur gabisa kemana mana,eyewitness
banjir woi banjir,eyewitness
udah banjir malah,eyewitness
bangun bangun udah banjir anjer,eyewitness
bangtan maap yaaaa diriku gaikut hype duluuuuu mikirin banjir,eyewitness
sama samaaa udh banjir lagi,eyewitness
banjir dan ujan makin gede siap,eyewitness
mantep bgt rumah gua banjir wowkwokwowkwowk,eyewitness
rumah gw masih aman fan jalanan depan rumah aja yg banjir u gimana hujannya awet bgt ni,eyewitness
ngangkutin barang banjir bang,eyewitness
banjir hari jumat yg masi di jalan hati hati yes,eyewitness
masih banjir mati lampu,eyewitness
iya tau ini lagi banjir,eyewitness
semana banjir juga daerah sini cm alhamdulillah rmh gue engga,eyewitness
akhirnya telkomsel sinyalnya normal lagi tp depan rumah msh banjir msh mati listrik,eyewitness
banjir di tempat gua,eyewitness
kemang pratama banjir btw,eyewitness
pemberitahuan libur dikarenakan banjir,eyewitness
banjir laaaagi guys,eyewitness
sini kerumah gk banjir,eyewitness
bnr kn banjir,eyewitness
hari ini extend cuti karena khawatir banjir,eyewitness
bismillah semoga tendean ga banjir gua mau lewat situ,eyewitness
udah banjir jalan kota putus barusan gempa,eyewitness
rumah aye kagak banjir tapi mati lampu mpok dari pagi sampe malem bet,eyewitness
rumah acu banjir,eyewitness
yah aku kejebak banjir,eyewitness
ikan koi gue ilang semua anjir grgr banjir,eyewitness
banjir hujan terus mati lampu langit gelap hmm berasa kembali ke,eyewitness
banjir parah,eyewitness
hujan beberapa jam saja jakarta mengalami kebanjiran adakah tempat yg bebas banjir,eyewitness
banjir lagi banjir lagi,eyewitness
gk bisa kerja dong banjir dimana hikseu,eyewitness
lanjut bobo kantor masih banjir,eyewitness
udh mati lampu banjir anjirrrr,eyewitness
demi apa sih kena banjir,eyewitness
depan kantor banjir arah mau kekantorpun banyak yg banjir bung apakah kerja hari ini,eyewitness
tiati banjir,eyewitness
ini banjir jakarta terparah selama hidup gw,eyewitness
kapan lagi kuliah sambil banjir banjiran ya kannn,eyewitness
wow kantorku banjir cm sebetis bawah doang sih but still,eyewitness
surut dong gue mau berangkat ke kampus banjir semuaaa,eyewitness
kasian papah gabisa kerja karna banjir,eyewitness
rumah aku banjir tapi surutnya cepet nah kerumahku ini yg masih pada banjir,eyewitness
banjir banjir huhu,eyewitness
gunung sahari jalan utamanya banjir,eyewitness
allhamdulillah ditempatku tidak banjir mbak,eyewitness
banjir ga bisa kemana mana,eyewitness
timur jakarta juga masih banjir lho,eyewitness
ini sih banjir terparah yang pernah gue rasain,eyewitness
tl ku lagi banjir stay safe semwaaa,eyewitness
sekarang banjir lagi tapi kan udah pindah,eyewitness
nerjang banjir demi angkut barang kelantai atas semangat,eyewitness
pulang ke cikarang disambut banjir di perumahan trims,eyewitness
hari ini diliburkan karena akses ke kantor putus karena banjir,eyewitness
ngeri ya banjir sekarang itu kenanya di area yang justru ga pernah banjir,eyewitness
banjir sekolah naik getek,eyewitness
sadisss euy tahun baru dikasi kado banjir kayak gini,eyewitness
hujan deras sampai banjir,eyewitness
banjir mas,eyewitness
ya allah banjir cepet surut kek,eyewitness
ini rumah gw banjir tinggi listrik mati,eyewitness
banjir wooy banjiiirrr,eyewitness
banjir dong,eyewitness
sekolahnya libur kena banjir huehue,eyewitness
semga hujan segera berhenti dan permasalahan banjir cepat segera selesai,eyewitness
banjir kak,eyewitness
sudah surut gak banjir lg,eyewitness
banjir banjir banjir datang lagi kawan,eyewitness
brebes juga dah banjir,eyewitness
msh di bls pabrik banjir krj an numpuk,eyewitness
lupa nder banjir soalnya,eyewitness
hiya besok ept dan hari ini masih banjir apakah bisa,eyewitness
waduhhh brooo jakarta banjir bro,eyewitness
mangat koh beberes banjir,eyewitness
hujan masih air dan jakarta masih banjir haaaaaaaaaaaa,eyewitness
jakarta banjir jakarta banjir,eyewitness
banjir di tabalong kalsel,eyewitness
sejak kemarin tabalong kalsel banjir,eyewitness
banjir dimana mana,eyewitness
banjir di tabalong,eyewitness
sumpah ahhhh aaaaaa banjir ah rumahh gini,eyewitness
jakarta banjir woi,eyewitness
ini air berkumpul bersama alias banjir,eyewitness
wal tanjung sudah banjir daerah buhan km banjir jua lah,eyewitness
banjir tanjung banjirrrr,eyewitness
kambitin banjir tanjung jadi samudera lim,eyewitness
baru awal february tanjung di guyur banjir,eyewitness
tanjung banjir,eyewitness
tanjung aja kah ni yang banjir,eyewitness
iyaaa tapi tanjung lagi banjir,eyewitness
di tanjung banjir nh om,eyewitness
hujan trs tiap hari tanjung banjir parah huhuu,eyewitness
jakarta banjir mbah,eyewitness
jakarta banjir,eyewitness
tanjung lagi banjir jaringan lwn listrik mati jar,eyewitness
tanjung priok dan sekitarnya banjir,eyewitness
banjir pak,eyewitness
astagfirullah banjir lg,eyewitness
banjir dahhh,eyewitness
spti nya ini banjir kiriman kah,eyewitness
margonda dpn itc depok banjir dek rmh adek sblh mana,eyewitness
aku kembali dgn badan serasa remuk banjir menyebalkan,eyewitness
walau banjir hadapi dengan senyuman,eyewitness
demi apa kantor gue banjir lg,eyewitness
tidak ada angin tidak ada hujan tiba tiba banjir kenapa jadi langganan tiap bulan gini,eyewitness
gatau gue lg ambil minum tau tau udh banjir aja tuh,eyewitness
otw jkt ga jadi ah macet banjir,eyewitness
saya tinggal di bangka setiap hujan deras pasti banjir daerah sini,eyewitness
alhamdulillah barang masih bisa diamankan kos banjir,eyewitness
semarang kaline banjir,eyewitness
banjir depan sekolah dongggg iniiii hemmmm,eyewitness
bener bgt malam ini banjir cuy sedih dah,eyewitness
asliiii belum setahun udah x banjir bawa aku pergi,eyewitness
banjir yaa iya kejebak parah ntar bang,eyewitness
banjir banjir mana toa mana toa,eyewitness
jakrta banjir,eyewitness
pusat banjir,eyewitness
ada ada bae ah orang mah lagi pada sibuk sama korona lah ini bekasi banjir lagi cuk,eyewitness
baru juga tidur eh banjir,eyewitness
haha banjir,eyewitness
semoga banjir cpt surut,eyewitness
ada aja pake segala banjir hadeh,eyewitness
baru kali ini ngerasain motor mogok gara kerendem air banjir,eyewitness
makin banjir,eyewitness
beres beres rumah efek banjir,eyewitness
bogor banjir,eyewitness
banjir blm kelar udah gempa aja,eyewitness
di rumah aja dulu bersihin lumpur banjir,eyewitness
jakarta banjir terus,eyewitness
jakarta bagian banjir,eyewitness
komplek mau banjir yu semangat yu,eyewitness
bekasi ini mah setiap hujan banjir,eyewitness
banjir banjir,eyewitness
masih banjir gan,eyewitness
jakarta banjir,eyewitness
villa nusa indah banjir lagi,eyewitness
tangerang banjir jg fa wkwkwkwk,eyewitness
banjir lagi semoga nanti siang surut di fedex rpx center lt,eyewitness
lah kosanmu kenak banjir mell,eyewitness
banjir sekalian,eyewitness
ah banjir toa siapin jgn sampai ketiduran selalu waspada,eyewitness
banjir dong,eyewitness
iyaa bun takut banget nih mana lagi banjir pula huhu,eyewitness
udah banjir aja hi,eyewitness
ronda bray jaga jaga dari air banjir malam ini,eyewitness
tai dimana mana banjir,eyewitness
semoga ga banjir lagi,eyewitness
sampah bgt sih skrg banjir,eyewitness
semoga tidak banjir aja,eyewitness
kemang pratama banjir lagi,eyewitness
dan akhirnya jakarta banjir kembali,eyewitness
macet banjir,eyewitness
stay alert sama banjir dbd jg ya gais,eyewitness
jalan depan banjir tadi tapi ga banget si,eyewitness
ini banjir surut sampe kapan si,eyewitness
lagi nugas poo mantau air banjir di depan rumah wkwk,eyewitness
skrg jd kawasan banjir,eyewitness
hampir motor mogok gara banjir,eyewitness
banjir bosss,eyewitness
sek kejebak banjir d jakartaaa,eyewitness
pak banjir pak,eyewitness
banjir bro,eyewitness
iya smngt tapi banjir ini,eyewitness
banjir lagiiii,eyewitness
lagi banjir begini malah ngantuk mana lagi rame di rumah,eyewitness
semoga ga banjir ya kasian teman ku nanti,eyewitness
kalo banjir pasti ngumpet,eyewitness
ujan ampe pagi besok nya banjir,eyewitness
banjir dimana mana macet dimana heuheu,eyewitness
ya allah semoga nggak banjir,eyewitness
banjir lagi,eyewitness
hujan seharian banjir masuk ke rumah,eyewitness
banjir dr sebelum maghrib surut jam atau set an ini baru selesai bebersih coi,eyewitness
rumah aku siaga banjir mulu,eyewitness
pls banjir damai yuk ak cape tau sebulan kali bersihin kamu,eyewitness
jakarta banjir lagi lagi banjir,eyewitness
iya ni udh banjir,eyewitness
mudah mudahan cuma siaga dan nggak jadi banjir,eyewitness
duhh moga ga banjir dehh,eyewitness
pulang jam segini sendirian jalan kaki dan banjir,eyewitness
rumah gua banjir,eyewitness
lockdown suruh di rmh terus tau taunya banjir hahahahahahahah,eyewitness
banjir juga,eyewitness
jangan banjir lagi,eyewitness
banjir mulu jink,eyewitness
rumah gue banjir,eyewitness
udah dapet laporan aja dari rt mau banjir,eyewitness
kelelep banjir,eyewitness
banjir kak tadi jalan jalan deket sini,eyewitness
banjir kayaknya,eyewitness
wah banjir,eyewitness
tetiba banjir datangggg,eyewitness
yok jgn banjir yok,eyewitness
iya huhuu padahal blm setengah tahun tp banjir terus,eyewitness
ya allah banjir lagi villnus,eyewitness
tadi sore niatnya bikin ubi kopong eh malah ngurusin banjir,eyewitness
mulai banjir lagi dmn yaa,eyewitness
banjir neee,eyewitness
banjir menehhh welahhh dalahhhh,eyewitness
banjir macet,eyewitness
banjir lagi nih,eyewitness
udah please jgn banjir lagi,eyewitness
mo banjir lagi di bekasi yaallah,eyewitness
banjir ka,eyewitness
cuk udah wabah corona banjir pula bekasi duh cobaan bener ini taun,eyewitness
banjir teros,eyewitness
uts diundur kelas diubah jd online semua eh plg malah kena banjir wkwkwkwkwk fuck,eyewitness
motor sih di dlm rumah sil di blok w udh banjir,eyewitness
awas banjir,eyewitness
ya allah balik ke kostan akses jalannya banjir,eyewitness
banjir,eyewitness
bengkulu banjir dan gempa,eyewitness
banjir banjir go away,eyewitness
kirain ada sesuatu diatas lemari semoga gajadi banjir ya lgsg surut,eyewitness
kena banjir dijalanan smpe mogok bete banget dah rasanya,eyewitness
iya tadi sore tempat gue banjir juga ternyata,eyewitness
rumah i banjir,eyewitness
bru selesai bersi bersi banjir,eyewitness
asli nih kemang pratama banjir lagi gak sik jangan ya allaaaaaah,eyewitness
semoga ga banjir lg ya rabb,eyewitness
aduh tolong yaa jangan banjir lagi,eyewitness
lagi banjir belum surut eh gempa,eyewitness
demi apa banjir lagi mut,eyewitness
demi apa ki banjir,eyewitness
bekasi siaga banjir toloonggg,eyewitness
banjir aja kiriman kali kali makanan kiriman kek bukan banjir kiriman,eyewitness
ya tuhan hentikan banjir di perumahan ku,eyewitness
potensi banjir,eyewitness
udah corona skrg ditambah banjir lengkap sudah penderitaan negri ini,eyewitness
banjir,eyewitness
hah ko banjir emg kpn ujan,eyewitness
jgn banjir flis,eyewitness
banjir,eyewitness
banjir deh kayanya,eyewitness
banjir guys,eyewitness
banjir kaaa kayaknya karna ujan gede tadi,eyewitness
iya ini dapet hadiah banjir kiriman,eyewitness
awas banjir,eyewitness
dari kmrnkmrnsiih tapi ini banjir kiriman,eyewitness
udah lagi ga enak badan lemes banget malem masih harus was banjir,eyewitness
skrg lg banjir jung,eyewitness
plis lah jangan banjir dulu yatuhan,eyewitness
oalajingan alarm banjir bunyi,eyewitness
banjir lagi bismillah sabar dan kuat,eyewitness
jgn sampe banjir lg please,eyewitness
lagi sibuk nungguin banjir si pinggir kali nih,eyewitness
gila ya banjir lagi,eyewitness
jalan ke mana cileungsi aja banjir,eyewitness
pdhl rumah gw udh tinggi tetep aja kena banjir duh yg blok blkg udah sedada dii,eyewitness
banjir mulu bekasi capek bgt yaallah,eyewitness
anjer males bgt pindah kebawah malah banjir,eyewitness
ngungsi again semoga gak banjir yaallah,eyewitness
ini masih banjir,eyewitness
banjir terus terus banjir,eyewitness
akhirnya nyampe ruma dimana banjir gabisa lewat hffftt,eyewitness
banjir bandang,eyewitness
ada ada aja daah malem banjir,eyewitness
tolong lah gosah banjir capek,eyewitness
bekasi jangan banjir plis,eyewitness
hahaha mana tau kan msh banjir sampe skrg dir,eyewitness
takut banjir ya,eyewitness
ya allah banjir lagi lah,eyewitness
kemang banjir juga,eyewitness
baru mau tidur terus ninu ninu mo banjir tu gmn ya sontak kaget,eyewitness
udah mulai banjir nih,eyewitness
mana banjir lagi ka,eyewitness
banjir,eyewitness
nonton kimsabu bikin nangis banjir sampe pusing,eyewitness
wakakakakak ujan dikit mah muncul banjir kalo di ekek,eyewitness
banjir gais,eyewitness
otw banjir men,eyewitness
di rumah banjir,eyewitness
dibangunin karna banjir astaga sampe kapan ini,eyewitness
