text,class_label
banjir jakarta itu bukan tentang air tapi tentang hati yang ga bisa move on,dontknow
boneka tidak bisa mengatasi banjir,dontknow
dari happy new year hingga banjir beragam topik hiasi hari pertama,dontknow
pantesan banjir hujan dr tahun sd,dontknow
jakarta sensitif yee ujan dikit banjir listrik mati bentar viral,dontknow
seketika ingin tinggal di apart kalo udah banjir gini tapi parkiran mobilnya di rooftop,dontknow
asli banjir jaman sd terparah sih seriusan sampe kek dulu prim,dontknow
nyari info banjir di twitter isinya pada nyalahin orang,dontknow
emg lu bisa bikin banjir sebogor,dontknow
banjir surut buat mengatasi minta dana dari apbd habis tuh duit rakyat dki,dontknow
nga enak buat ruma rawan banjir,dontknow
jakarta sedang banjir masihkah berpikir ini banjir kiriman atau antrean air,dontknow
gak banjir sih cuma flu masih hujan disini,dontknow
ini kalo sampe banjir lucu sih,dontknow
keknya si banjir di dpn yapera ini di purbetnya aja banjir,dontknow
lagi corona dan banjir,dontknow
banjir pindah dari jakarta keluar jakarta,dontknow
happy new year klo kata orang ujan itu bawa hoki klo banjir ya nasib,dontknow
dah lah gamikirin dispatch lagi gua ini ngeri banget banjir,dontknow
lengkap sdh banjir matilampu,dontknow
kaga pernah banjir duit,dontknow
baca twit kebanjiran paling positif smoga lekas surut banjir jepangnya ya mas,dontknow
orang entertainment masih bisa joget tertawa ria dan ngebuly orang ga ya musim banjir gini,dontknow
tol cipali banjir kemaren tapi tarif tolnya mau naik ya awal tahun,dontknow
biar video nya ga keliatan ya jadi gub dki ga bisa liat dalamnya banjir tak sedalam cintaku padanya,dontknow
waw hujan terus apakah akan banjir,dontknow
banjir air mata,dontknow
twitternya polda metro isinya banjir,dontknow
gapernah terbesit sama sekali ternyata first new year wish gue adalah banjir tidak tambah tinggi cepet surut kl kata buibu rt semoga ini banjir berkah tahun ini aamiin sih tapi hehe,dontknow
banjir ga d rumah lo,dontknow
bangun selain baca berita banjir cek bpjs udah naik belom,dontknow
st day yeaay and st time banjir dalam dan luar rumah xiexie,dontknow
gapapa aku pengen aja nangis sampe banjir banjir,dontknow
banjir aer mata kekalahan,dontknow
pas dianya bangun aelah banjir dikit doang lanjut tidur lagi,dontknow
ga biasanya kena banjir mandala ku tersayang besok pindah ah ke puncak,dontknow
air dari samudera hindia menjadi hujan dan banjir di banyak negara saat ini bukan jakarta doang,dontknow
min mau reschedule tiket kereta gimana ya caranya ga harus ke loket stasiun nya kan soalnya banjir,dontknow
genangan air itu bkn banjir ntar pendukung gubernur marah hahaha,dontknow
kalo disitu aja udah banjir gimana jalan pom bensin bates ya,dontknow
untung rumah di jagakarsa daerah tinggi di jakarta selatan masih ijo kebon kebon dan banyak selokan pula jadi bertahun ga pernah ngerasain jangan sampe kena banjir paling bocor doang,dontknow
sinyal banjir rezeki di tahun,dontknow
hujan adalah berkah banjir,dontknow
happy new year gengs kuanggap banjir ini adalah rejeki yang berlebihan aamiin,dontknow
memulai dengan banjir keberpihakan emang the best,dontknow
apakah banjir ini juga termasuk ulah hacker,dontknow
berkah banjir diawal tahun,dontknow
pedih bercucuran air mata banjir sungai landak dibuatnya,dontknow
gpp banjir asalkan bukan di bumi,dontknow
yg ngedoain hujan semalam malah sampai semoga cepat surut banjirnya,dontknow
bodoamat ama dispatch ini ujan tulung berenti dong takut gue kalo banjir gini,dontknow
banjir air antri aja ini media melebihkan nih,dontknow
udah dari kemarin sore ga berenti sepertinya akan banjir dimana,dontknow
pantauan banjir di pulo gebang cakung alhamdulillah banjir kali ini terasa lebih santun cc,dontknow
yang gue pikirin saat banjir ini adalah printilan gue gimna anjir,dontknow
ini bukan banjir ini air ngantri masuk ke tanah,dontknow
banjir karena tidak ada resapan mundur karena tidak ada harapan,dontknow
gpp banjir asalkan banjir kasih sayang,dontknow
gpp banjir asalkan kamu tetap cinta aku,dontknow
banjirnya banjir uang,dontknow
ternyata gacuma di bumi di planet lain juga banjir,dontknow
cuma ujan banjir yang bisa bikin keluar rumah,dontknow
bae tengok rumah sapatau banjir,dontknow
planet banjir,dontknow
pasti salah redaksi bukan banjir ini cuma antrian air masuk sungai,dontknow
bekasi banjir salah anies juga,dontknow
di tahun baru ini semoga lingkungan rumah mu ga banjir yaa apalagi banjir di pipi,dontknow
air mata buaya sebabkan banjir,dontknow
tahun baruan haji aom banjir lur hadehh,dontknow
buang sampahnya banjirnya,dontknow
banjir uang,dontknow
banjir aer mata gara gara exo kemaren,dontknow
anjiiirrrrr banjir sara,dontknow
kasian kucing gue ini bingung dia banjir gini drtd cuman diem aja di kasur,dontknow
banjir gapapa yg penting seagama gitu bukan,dontknow
anggaran mengatasi banjir kan ude d potong jt bro inget kan,dontknow
penuh pasti keluarin deh siapa tau bikin banjir,dontknow
buang sampah tinggal lempar pengen ga banjir,dontknow
innalilahi banjir terasa berkah karena pemimpin nya seiman,dontknow
banjir rindu,dontknow
hanya saat banjir rumah muncul mata air dari berbagai sudut ubin,dontknow
jangan nangis dop banjir ini,dontknow
nangis sampe korea banjir,dontknow
gak jd di sini ternyata banjir kenangan,dontknow
situ sering buang sampah di sungai cuman pas kena banjir nyalain nya pemerintah situ sehat boss,dontknow
aku pas khunfanny banjir air mata,dontknow
banjir membawa berkah dan rahmah,dontknow
banjir aja indah keliatannya,dontknow
banjir jakarta di awal merubah arus suara pilpres,dontknow
twitter pun kebanjiran banjir,dontknow
ohh paling ngeri klo banjir ada ular,dontknow
water mau banjir kayak apa juga warganya ga nyalahin iceburg,dontknow
bukan mata yg buta tapi hati di dalam dada belum pernah kena banjir kali bapak inih,dontknow
di bali banjirnya beda di bali banjirnya banjir kendaraan,dontknow
heeng hati q banjir air mata,dontknow
aku ngeri ada ular aza klo banjir begitu kak,dontknow
galaxy masih banjir gak sih huhu,dontknow
dijual tanah di pondok kelapa bebas banjir terbukti sabarr yaaa,dontknow
apakah ada banjir di tol jakarta tangerang,dontknow
mohon infonya jalan arah puri dan srengseng banjir ga min,dontknow
biaya hidup solo gaji jakarta aman dari banjir,dontknow
semoga dari kejadian banjir ini masyarakat indonesia bisa buang sampah pada tempatnya,dontknow
mohon info untuk airport cengkareng apa masih beroperasi normal kondisi tol kesana apakah banjir,dontknow
banjir akan lebih mudah diatasi jika tidak hujan,dontknow
bukan banjir tapi kolam milo,dontknow
banjir ga banjir ga,dontknow
banjir dikota mu adalah curah rindu yang tak tertampung dihati ku,dontknow
bukan banjir pak tapi air nya terlalu sopan buat ngantri masuk ke tanah,dontknow
informasi permobilan dalam menghadapi banjir,dontknow
kaka sebelum nya blm tau jalan yg di lalui bakal banjir,dontknow
menurut anda bencana banjir ini termasuk azab atau salah management tata kelola bang,dontknow
sebenernya ini sesimple kalo bisa yg bebas banjir itu gak cuman yg kaya aja yg miskin juga bebas banjir semisal kesenjangan bla bla apalagi udah sampe bahas sistem ekonomi itu udh beyond this discussion udh lama jadi perdebatan juga dimana bahkan di dunia btw good morning,dontknow
kayak ini ya saya cuma senyum aja mungkin dia ingat pelajaran sd kalau kasus banjir jakarta walau got nya lancar tetap aja banjir karena air tidak langsung ke laut akibat normalisasi sungai tidak bagus,dontknow
itu gubernur kebanggan anda jadi gubenur hasil jualan ayat mayat banjir di jakarta bisa juga teguran dari allah buat pejabat yg tamak,dontknow
banjir kartu torino bikin milan babak belur di stadio olim grande,dontknow
formula e antisipasi banjir,dontknow
bagaimana cara mengklaim asuransi mobil terendam banjir jakarta berikut jawabannya,dontknow
penyebab banjir di jakarta adalah air,dontknow
bagaimana kalau kita kirimin air banjir buat memadamin kebakaran di australia,dontknow
klo pada ngeluh jakarta banjir mending pade pindah ajeee dah dr jaman kumpeni jg jakarta langganan banjir,dontknow
racikan wedang jahe ini siap hangatkan tubuh saat cuaca dingin pasca banjir,dontknow
ini keran kaga ditutup tahun makanya banjir,dontknow
w nangis bikin banjir emg,dontknow
untung rindu yang deras bukan hujan bisa bisa banjir,dontknow
indonesia now banjir bandang manusia jahiliyah pendusta penipu pecundang,dontknow
gubernur real sociedad gpp banjir atuh anak anak seneng main air gembira tuh liat ada yg salto,dontknow
cil klo banjir ada buaya lah banyak jar buaya darat tanjung rema,dontknow
itu motor diuji coba saat banjir di mana tuh karena di jakarta enggak di temukan banjir seperti itu,dontknow
baguslah spot banjir bikin wisata air tahunan gitu aja kok repot,dontknow
gpp banjir asalkan aku bisa ngopi,dontknow
awal th banjir dimana mana baru masuk bulan ke udah ada virus bulan ke udah mulai puasa katanya pertengahan bulan ada kejadian sesudah sahur eling barudak bisi ahir jaman,dontknow
taun lalu di tgl ini kita libur krna banjir bandang sentani v,dontknow
bisa ga sih corona nular lewat banjir serius nanya creepy,dontknow
naaaaaa ini di mana rumah pondam banjir,dontknow
banjir berjilid aja gk takut apa lg corona,dontknow
kalinya gak dikeruk keruk siap siap aja banjir terus setiap dapet kiriman bogor,dontknow
banjir corona bukan kombinasi yg baik stay safe bekasian,dontknow
penanganan banjir sekalian pak biar lunas dan menjadi pikiran,dontknow
disuruh jaga jarak eh ini malah dikumpulin haduhhhh beg gak sembuh pantes lawan banjir mencret,dontknow
kerja lebih pagi deh tudey banjir dm twitter,dontknow
berlaga mau urus si covid ngurus banjir aj g becus,dontknow
dari desemberan dimana waktu itu masih sibuk ngomongin banjir,dontknow
covid beda sama banjir tahun mungkin yang masih ingat,dontknow
banjir corona banjir corona banjir corona banjir corona banjir corona banjir corona banjir corona banjir corona,dontknow
lawan banjir aja mencret,dontknow
banjir karena tidak ada resapan mundur karena tidak ada harapan wea wee,dontknow
buang sampah sembarangan pas kebanjiran nyalahin pemerintah,dontknow
ngatasi banjir ga pecus bikin kebijakan tambah macet,dontknow
waah selain pandemi korona banjir juga sudah tersedia di depok tepatnya depan itc mantap,dontknow
masa banjir nyokap tumben siaga ga nelfon,dontknow
wkwk terisolir ini perumahan masih banjir ga sih pondok,dontknow
engga virus engga banjir udah gaada harga dirinya di negara,dontknow
mustinya si banjir yg diajari social distance mbok yaa lain kali aja kasian kan rasyid salah terus,dontknow
adegan ini di drama aslinya bikin banjir air mata tapi di indo dijadiin dagelan,dontknow
bumi induk sedang mengurangi virus yg menyebabkan global warming polusi banjir dll yg bernama manusia,dontknow
apakah semalam banjir,dontknow
itu bukan banjir tapi water boom,dontknow
emang nya depok suka gitu ya tiba banjir masih sayang trus tiba ngilang wah,dontknow
org itu sdg mabok lem akibat kelelep banjir,dontknow
gak ada seremnya bikin banjir airmata,dontknow
mantaaaaab corona banjir,dontknow
banjir itu sdh normal,dontknow
banjir pejuh di gurun,dontknow
banjir keringet,dontknow
banjir nyata virus maya,dontknow
apakah banjir di jaman nabi nuh terjadi karena penebangan liar untuk membuat perahu,dontknow
mereka gatau sebenernya kamar w banjir air mata,dontknow
oh dipotong kek anggaran banjir dki ya bisa dipotong,dontknow
samudra terlalu luas utk ku arungi kena banjir saja ku ogah,dontknow
virus di sebar banjir,dontknow
di tengah ramainya corona banjir pun ikut meramaikan,dontknow
lagi belajar ke shuffle lagu dear dream jam segini terus malah dilanjut nonton ini banjir guys banjirrr,dontknow
banjir kasih sayang,dontknow
serem saking seremnya banjir air mata gue,dontknow
capek bgt marathon nonton cloy mulai episode aja udh banjir nih pipi,dontknow
banjir corona wah bener bener awal tahun yang berat,dontknow
akting corona hari rabo berakhir hadapi kenyataan banjir lagi jakarta,dontknow
nangisnya makin banjir ini,dontknow
inget waktu kkn semua temen pada tidur aku tengah malam nntn ini kirain bakal seren rupanya banjir air mata,dontknow
plis jangan ada banjir jakarta soal jakarta udh sibuk sama codiv gatega aku,dontknow
gpp banjir asalkan punya pacar,dontknow
jangan nangis phi banjir,dontknow
banjir air liur,dontknow
suruh tenggorokan nya banjir,dontknow
kita nangis bareng supaya banjir hehe,dontknow
samaaaakkkkk aku nangis banjir nonton scene ini,dontknow
ada banjir rame ada gempa rame ada kebakaran rame,dontknow
dia punya plot twist tu sampai banjir jugak lahh pipi ni,dontknow
aduh ngurus banjir aja gak beres,dontknow
mungkin seperti banjir yang datang nya tiba tiba dan pergi nya perlahan,dontknow
corona banjir,dontknow
adu aku banjir,dontknow
banjir dan pohon di monas tertelan corona,dontknow
facebook marketplace powerful untuk mendatangkan banjir orderan,dontknow
banjir banget nonton hi bye mama episode,dontknow
kamar bocor kagak banjir tpi bocor,dontknow
udah corona banjir ah lengkapnya,dontknow
korona n banjir melengkapi derita warga jkt gegara kebijakan wan aibon yg amburadul,dontknow
udahlah corona banjir pula,dontknow
mampus ga lu brusan di rep lg suruh pake aplikasi banjir,dontknow
jadi inget yg blg banjir pas libur,dontknow
susah mah kalau diterapin di indo banjir aja nyalahin gubernur padahal mereka sendiri yg suka buang sampah sembarangan,dontknow
hujan angin kenceng banjir petir puting beliung dan segala macam fenomena alam,dontknow
banjir air mata juga,dontknow
kalo banjir enak ya ga tenggelam,dontknow
awal tahun banjir yang tak kunjung surut sampe corona ampe un diundurr semoga gaada kejadian yang ngeri ngeri lagi amin,dontknow
banjir dimana goy banjir kenangan atau banjir lautan asrama haha,dontknow
dulu kerja di transmart mau banjir ujan geledek jga bodo amat kudu harus ttp wajib fardhu ain harus masuk,dontknow
wc sekolah saya dulu kalo yang kencing barengan org langsung banjir tum,dontknow
yg lain mah libur kantor aku mah setronglah mau badai banjir gempa corona ga kenal kata libur alhamdulillah aja ya semoga dikasih sehat nda,dontknow
hati nya banjir harus di evakuasi,dontknow
sembur aje pake aer banjir rin wkwk,dontknow
illegal logging sumber bencana banjir,dontknow
banjir gk ada panggungnya,dontknow
virus corona bakal menular lewat air banjir ga ya btw,dontknow
banjir itu berkah itu kata orang di jaman anis,dontknow
sedih ga sih udah lagi ada virus corona terus banjir lagi,dontknow
kirain sisa corona aja warga jakarta masih harus mikirin banjir juga dong,dontknow
kalo jakarta banjir pas situasi gini apakah masih bisa sesantuy biasanya,dontknow
bener belom lagi ostnya yg dinyanyiin iu duh makin banjir,dontknow
aku terjebak dalam lautan banjir,dontknow
banjir itu sebahagian dari kutukan allah makanya jgn membuang kotoran sembarangan pahammmmmmmm brooooo,dontknow
banjir kali ini serasa ada manis manisnya gitu koplak,dontknow
hah klo banjir kiriman ya jgn diterima donk km gmnasi,dontknow
iya kalah lah banjir bisa marathon gitu,dontknow
pamer kemampuan main tenis yuku kato banjir pujian dari netizen,dontknow
corona dbd banjir kapan semua berhenti,dontknow
efek korona banjir ga terkenal lagi,dontknow
corona banjir amat berwarna hidup ini guys,dontknow
banjir corona entah ujian apalagi ini,dontknow
i hope indonesia akan lebih baik kedepanya dri yg banjir sampai yg virus smoga kita slalu dilindungi dan smuanya bisa ditangani,dontknow
beautiful world tiap eps banjir air mata,dontknow
kota hujan hehe kota yg suka ngirim aer banjir ke jakarta,dontknow
dan corona pun ikut berenang dlm banjir,dontknow
emosi lengkap adlh tbtb banjir motor gua kerendem lg pas dijalanan rmh udh sepaha pdhl gua abis servis motor bangsat ganti busi oli kuras tangki bensin anjink trus hp gua tinggal ngecas taunya ga keisi grgr kabelnya kurang ke dlm lengkap pgn masukin dajjal ke neraka rasanya,dontknow
banjir karena tidak ada resapan mundur karena tidak ada harapan,dontknow
ih apaan siii eps udahhhh bikin banjir ajaa arghhh keselll,dontknow
gue kirimin banjir dari sini mau ga,dontknow
okesip cukup jakarta banjir airmata jgn kebun lu lagi,dontknow
rekayasa cuaca dong nanti banjir lagi,dontknow
bencana alam banjir virus corona indonesia kuat,dontknow
iya lbh mementingkan formula e drpd menangani banjir tepat sekali penilaian anda,dontknow
musti di lock down nich biar banjir jangan meluas kemana mana kasihan warganya,dontknow
ini motor kebanggan banget ga pernah jatoh ga pernah rewel terobos banjir pun ga mati,dontknow
baiklah corona hujan banjir kombinasi yg menarik,dontknow
merapiii itu kalau meletus asinya bikin bikini bottom banjir,dontknow
developer zoom dkk banjir duit wkkw,dontknow
mau tsunami hujan badai banjir semua gada halangan untuk kantor w,dontknow
starbak air banjir mau rasa cappucino itu,dontknow
setelah hujan turun terbit banjir timbul jalan rusak,dontknow
banjir gimana deh,dontknow
iyo nek banjir wisata air pokoke wisata terus haha,dontknow
banjir corona,dontknow
eh jangan nangis neng banjir ntar hehehe,dontknow
pernah baca cerita ini pendeta banjir,dontknow
siap aja pak sekda tampil lagi ketika gabener udah mentok kyk pas banjir,dontknow
wow banjir konten bgt buat mimin jodohtiti,dontknow
jangan nangis disini banjir,dontknow
udh tahun tinggal disini udh ngerasain rasanya banjir dr kecil dan baru sekarang ngerasa nggak betah bgt pengen pindah banjir udh kelewatan bgt,dontknow
monster banjir bilang jangan lupakan saya saya masih terus meneror warga,dontknow
corona banjir,dontknow
banjir x corona bgt ni,dontknow
nerobos banjir membuatku ingin makan mie soto pedes bgt atau ga seblak atau ga rujak kangkung,dontknow
combo corona banjir mantap apakah virus nya mati,dontknow
km ga brnti cry kopo banjir,dontknow
banjir libur giliran corona masuk teros,dontknow
kamu mirip banjir bandang soalnya,dontknow
terus klo banjir pada ngamuk deh pdhl mrk beli rumah ditempat yg ga seharusnya dijadiin perumahan,dontknow
bnpb lagi ngurus corona kalo ampe banjir juga turun dah urusan yg laen laen mah nanti aja,dontknow
gpp banjir asalkan kamu selalu ada disampingku,dontknow
ku indah corona banjir,dontknow
corona banjir macet buyaro ae jakarta iku,dontknow
bisa jadi pelampung kalo banjir,dontknow
tumbenann banjir apa guenya yg gak pernah tau ya,dontknow
termasuk antrian air banjir,dontknow
minum kobokan dulu mas atau mukanya cuci muka dulu pake air banjir,dontknow
asalkan banjir uang,dontknow
kangen hp ak yg kena banjir wkwkw random bgt tulul,dontknow
cuti ayah always beku time raya time banjir time kemarau,dontknow
corona banjir,dontknow
yaallah udh lg rme corona skrg banjir,dontknow
jangan nangis nanti jakarta banjir,dontknow
ujan ujanan biar ga banjir,dontknow
banjir mataku banjirr siapa yg naro bawang disini,dontknow
banjir air mata tolong,dontknow
banjir pejuh,dontknow
emg bener ya beautiful world bikin mata banjir,dontknow
roti canai banjir,dontknow
langit yang hujan kenapa matamu yang banjir,dontknow
belom siap bismillah dulu aku takut banjir air mata,dontknow
auto goyang tapi mata banjir,dontknow
aku pernah ngetik gapapa tapi mata udah banjir,dontknow
sampe banjir ini hati,dontknow
jgn nngis nanti banjir,dontknow
iya nih jd banjir pipinya,dontknow
banjir isak tangis,dontknow
sekalian sampang banjir pole,dontknow
banjir ra penonton pada nangis semua,dontknow
banjir kata anis adlh genangan air,dontknow
cuma banjir airmata,dontknow
jangan nangis ntar banjir yen,dontknow
banjir air mata ini mah,dontknow
banjir kenangan,dontknow
iya nangisnya banjir,dontknow
siap siapppp tiap episode banjir air mata,dontknow
jangan nangis kak banjir,dontknow
apakah lagunya akan banjir air mata lagi ya ampon,dontknow
banjir kenangan,dontknow
itu bukan banjir itu water park,dontknow
pipimu dah banjir ituuuu,dontknow
jangan nangis sis banjir nanti awkokkk,dontknow
aku banjir air mata,dontknow
jangan mewek nanti banjir chan,dontknow
banjir air mata,dontknow
hidung banjir,dontknow
udah banjir air mata ini,dontknow
jangan mewek ah nanti banjir,dontknow
banjir parah kalo bisa di kumpulin nih air mata ga nyerep ke kulit,dontknow
sampang banjir pole sampang banjir pole,dontknow
nangis sudah banjir air mtku,dontknow
jan nangis tar banjir,dontknow
sampang banjir pole sampang banjir pole,dontknow
nangis banjir sebioskop,dontknow
jadi gini rasanya banjir konten,dontknow
banjir rindu,dontknow
hhhh panas banget banjir keringettt,dontknow
banjir air mata,dontknow
banjir ntar jgn nnagis,dontknow
w banjir air mata udh,dontknow
ney roti biasa satu banjir,dontknow
aaaamiin copid cepet slesai kamu main aku kerja nangis hingga banjir sejawabarat,dontknow
belah mana yang banjir tu weh,dontknow
pemkab e sidoarjo wes kebal dilapori banjir ae bebel,dontknow
berita terkini dosen dan mahasiswa unisma banjir tawaran beasiswa ke taiwan,dontknow
kalo ngambek jakarta banjir wkwk,dontknow
banjir daerah mana itu moots,dontknow
sampang banjir bore,dontknow
maukah anda merasakan banjir orderan dari facebook marketplace seperti mereka,dontknow
dalam kepala ku autoplay sampang banjir pole,dontknow
nonton banjir bukan avengers endgame,dontknow
nangis banjir pas di bioskop ya ga,dontknow
banjir kritik liverpool akhirnya batal minta bantuan pemerintah untuk bayar gaji karyawan,dontknow
km jgn nangis nanti banjir katsitu,dontknow
jangan terharu nanti banjir,dontknow
setelah ditahan banjir jg ni air mata,dontknow
iyaaa udah aaahh baper bgt kak tiati ntar banjir air mata,dontknow
produksi ribuan apd siswa smk jatim banjir pujian,dontknow
daerah mna hyunk banjir,dontknow
kamu tuh bukannya tidur malah banjir air mata,dontknow
banjir air mata,dontknow
mentab gue banjir loe semua,dontknow
di gurun mana ada banjir bang,dontknow
jgn nangis sia sia upaya pemerintah menanggulangi banjir,dontknow
dah lama praktis macam ni masa musim banjir,dontknow
selalu dah kalo liat ff banjir dah ni mata,dontknow
gila gila gila sampe banjir,dontknow
langsung banjir like,dontknow
noooo nt banjir hostel ni,dontknow
di ep aja udh dibikin banjir,dontknow
banjir ga si hujan hujan gini di delima,dontknow
mana ada ya banjir angin,dontknow
hi bye mama banjir air mata,dontknow
susu kental manis nya banjir gitu,dontknow
jangan nangis weh entar mentab saya banjir,dontknow
yah nangis banjir deh,dontknow
banjir bgt sumpah nonton ini,dontknow
jan nangiss tar banjir hehehhe,dontknow
banjir tugaaaass,dontknow
banjir lebih seru,dontknow
jangan nangis met banjir ntr,dontknow
wp apa cerita yang bikin kalian banjir air mata,dontknow
banjir bgt kuah nya,dontknow
banjir sampe sembab,dontknow
banjarnegara sudah dr minggu lalu banjir pemudik pak lha aku arep mudik sby ae ora wani,dontknow
banjir asupan aw,dontknow
jangan nangiss nnti mentab ak banjir,dontknow
bagus wkwk lagi nyari drakor banjir,dontknow
ringan tapi membuat banjir air mata,dontknow
coba uwma dah beberapa episode banjir sik,dontknow
itu cuma kolam renang bukan banjir,dontknow
yaallahhhh hshshsh aku dah kls kenapa makin kesini makin banjir tugasss,dontknow
banjir angin ntar,dontknow
aku seneng bakul banjir orderan aku gaseneng krungu ditakoki skripsi,dontknow
pantes banjir terus hutannya gundul,dontknow
banjir paket makanan ini tanda kalau saya harus makan,dontknow
awas nangiiiss banjir nanti,dontknow
promise banjir,dontknow
ga siap asli buat liat kelanjutannya takut banjir air mata,dontknow
emg bekasi gak banjir apah,dontknow
gak nangisss ituuu banjir,dontknow
banjir ingus air mata,dontknow
banjir update awokwkwk,dontknow
banjir pujian dan respon positif oleh warga banyumas dan semoga menjadi inspirasi,dontknow
hati ku banjir bang,dontknow
hasil berburu banjir,dontknow
banjir konten emang paling bisa anda,dontknow
bingung mau khawatir corona apa banjir,dontknow
lahh matanya banjir dong,dontknow
tiati banjir siapin tissue,dontknow
gpp banjir sekarang itu lebih santun amanah dan seiman,dontknow
mimin gercep banget kalo soal banjir di jakarta kasih info nya,dontknow
mentab gua banjir lur,dontknow
mataku kehujanan airnya bikin banjir,dontknow
tweet mu banjir emot bunn,dontknow
tolong ya saya lagi gamau banjir air mata,dontknow
bentar lagi banjir give away,dontknow
banjir hadiah,dontknow
jgn nangis ntar banjir,dontknow
aku suka banget ujan tapi gasuka banjir,dontknow
nangis banjir,dontknow
banjir ntar ras air mataku,dontknow
iye banjir bensin motor gua tu banjir urus dah,dontknow
jgn mnangid nanti banjir,dontknow
ayam goreng panaih panaih kuah banjir ishh,dontknow
anak komplek auto renang deh kalo ada banjir tuh kan jadi plesbek,dontknow
ya allah kita emang nggak akan pernah tau waktu terakhir ketemu seseorang ya om gue super baik selalu inget dan bantu saudara ikhlas rumahnya jadi tempat pengungsian keluarga gue waktu banjir tahun baru kemarin pagi ini meninggal,dontknow
masak mie trus wajannya dutaroh di wastafel airnya ngocor terus rumah jadi banjir,dontknow
kamu tau gak yg lebih bahaya dari pada banjir apa iya kamu yg telah membanjiri hidup ku tanpa adanya kepastiannya yaaa,dontknow
kucing aku slalu baring mcm ni astu klau tido air liur basi dia jgn ckp la banjir kt mulut habis basah bulu dia aku pon tk faham la jenis kucing mcm ni hahaha,dontknow
hari mimpiin si akang sampe nangis pas bangun mata udh banjir dahal udh ga mikirin loh,dontknow
kalo dideket kampus k udah banyak banget sampe banjir gacukup wadahnya bisa dimakan buat dua orang juga d,dontknow
aku kalo nonton ini gak pernah sm end gak kuat aku nontonnya banjir air mata,dontknow
coba banjir kemarin dateng pas sekarang kelar hidup lw nis,dontknow
paling lagi mimpi banjir,dontknow
pagi dah bikin kerjaan aja selang mesin cuci pake bocor alhasil banjir di dalem rumah,dontknow
humor loli receh banget padahal udah banjir dollar kenapa sih,dontknow
